ad,dogum_yeri,dogum_tarihi,yas,ilkokul,ilkokul_yillari,lise,lise_yillari,universite,universite_yillari,bolum,yuksek_lisans,yuksek_lisans_yillari,doktora,doktora_yillari,calistigi_kurumlar,calisma_yillari,kurdugu_girisim_ve_dernekler,girisim_kurulus_yillari,yasadigi_sehir,hobiler,es,cocuklar,akademik_yayinlar,yayin_yillari,dosya_adi,ilkokul_yillari_baslangic,ilkokul_yillari_bitis,lise_yillari_baslangic,lise_yillari_bitis,universite_yillari_baslangic,universite_yillari_bitis,yuksek_lisans_yillari_baslangic,yuksek_lisans_yillari_bitis,doktora_yillari_baslangic,doktora_yillari_bitis,calisma_yillari_baslangic,calisma_yillari_bitis
Özge Şimşek,İzmir,14.07.1988,37,Atatürk İlkokulu,1994-2002,İzmir Fen Lisesi,2002-2006,Ege Üniversitesi,2006-2010,Arkeoloji Bölümü,Ege Üniversitesi,2010-2012,,None,"['Türk Arkeoloji Enstitüsü', 'İzmir Arkeoloji Müzesi', 'Anadolu Kültür Vakfı']","['2012-2015', '2015-2019', '2019-devam ediyor']",[],[],İzmir,"['dağcılık', 'doğa yürüyüşleri', 'belgesel izlemek', 'antik sikkeler koleksiyonu yapmak']",Caner Yılmaz,"['Ela', 'Deniz']","['Batı Anadolu Antik Kentlerinde Sürdürülebilir Turizm ve Koruma Politikaları', ""Türkiye'de Kazı Alanlarında Toplum Katılımının Önemi: Bir Vaka Çalışması"", 'Dijitalleşme Çağında Müze Eğitimi ve Genç Kuşaklara Erişimi']","['2012', '2016', '2020']",ozge_simsek.md,1994,2002,2002,2006,2006,2010,2010,2012,None,,['2012,"2015', '2015-2019', '2019-devam ediyor']"
Özge Yıldız,Antalya,15.03.1987,38,Mimar Sinan İlkokulu,1993-2000,Antalya Lisesi,2000-2004,Boğaziçi Üniversitesi,2003-2007,İşletme,İstanbul Bilgi Üniversitesi,2007-2009,,None,"['Unilever Türkiye', 'Vodafone Türkiye', 'Garanti BBVA', 'Turkcell']","['2009-2012', '2012-2016', '2017-2020', '2020-devam ediyor']",[],[],İstanbul,"['amatör fotoğrafçılık', 'yoga', 'pilates', 'yemek kurslarına katılmak', 'seyahat etmek']",Onur Demir,"['Deniz', 'Ece']","['Mobil Uygulamaların Tüketici Satın Alma Kararları Üzerindeki Etkisi: Türkiye Örneği', 'Yapay Zeka Destekli Pazarlamanın Geleceği ve Etik Boyutları']","['2009', '2022']",ozge_yildiz.md,1993,2000,2000,2004,2003,2007,2007,2009,None,,['2009,"2012', '2012-2016', '2017-2020', '2020-devam ediyor']"
Özgür Bulut,Kayseri,12.07.1985,40,Yavuz Selim İlköğretim Okulu,1991-1998,Kayseri Lisesi,1998-2002,Marmara Üniversitesi,2002-2006,Gazetecilik Bölümü,Galatasaray Üniversitesi,2007-2009,,None,"['Hürriyet Gazetesi, Spor Servisi', 'NTV Spor', 'beIN Sports Türkiye']","['2006-2010', '2010-2017', '2017-devam ediyor']",['Maçın Perde Arkası Podcast Serisi'],['2019'],İstanbul,"['eski Türk filmlerini izlemek', 'Yeşilçam klasikleriyle ilgilenmek', 'profesyonel düzeyde fotoğrafçılık yapmak', 'doğa yürüyüşlerine çıkmak', 'amatör olarak satranç oynamak', 'tenis oynamak']",Aslı Bulut,"['Defne Bulut', 'Can Bulut']","['Türk Futbol Medyasında Dönüşüm: Dijitalleşmenin Etkileri ve Gelecek Trendleri', 'Sporda Marka İletişimi ve Taraftar Bağlılığı Üzerine Bir Araştırma: Büyük Kulüpler Örneği']","['2018', '2009']",ozgur_bulut.md,1991,1998,1998,2002,2002,2006,2007,2009,None,,['2006,"2010', '2010-2017', '2017-devam ediyor']"
Özgür Özsoy,Adana,15.06.1985,40,Adana İsmet İnönü İlkokulu,1991-1996,Adana Anadolu Lisesi,1996-2003,Ankara Üniversitesi,2003-2007,Gazetecilik Bölümü,Hacettepe Üniversitesi,2008-2010,,None,"['Milliyet Gazetesi', 'NTV Spor', 'Türk Telekom', 'bein Sports Türkiye', 'Fanatik Dijital Medya']","['2007-2011', '2011-2015', '2015-2018', '2018-2022', '2022-devam ediyor']",['Geleceğin Yıldızları Derneği'],['2019'],İstanbul,"['amatör futbol oynamak', 'doğa yürüyüşleri', 'sinema ve film eleştirileri yazmak', 'vintage fotoğraf makineleri koleksiyonu yapmak']",Elif Özsoy,"['Defne Özsoy', 'Can Özsoy']","['Sosyal Medyanın Taraftar Kültürü Üzerine Etkisi: Türkiye Örneği', 'E-Sporun Yükselişi ve Medyada Temsili']","['2013', '2017']",ozgur_ozsoy.md,1991,1996,1996,2003,2003,2007,2008,2010,None,,['2007,"2011', '2011-2015', '2015-2018', '2018-2022', '2022-devam ediyor']"
Özgür Şimşek,Ankara,15.06.1989,36,Ankara Sıhhıye İlkokulu,1995-2000,Ankara Atatürk Lisesi,2000-2007,Orta Doğu Teknik Üniversitesi,2007-2011,Bilgisayar Mühendisliği,Boğaziçi Üniversitesi,2011-2013,,None,"['Turkcell', 'Garanti Teknoloji', 'Global AI Solutions']","['2013-2015', '2015-2018', '2018-devam ediyor']",['Veri Okuryazarlığı Derneği'],['2020'],İstanbul,"['dijital sanat eserleri üretmek', 'uzun mesafe koşusu yapmak', 'doğa yürüyüşleri yapmak', 'fotoğrafçılık']",Elif Şimşek,"['Zeynep', 'Can']","['Makine Öğrenimi Destekli Finansal Dolandırıcılık Tespiti Modelleri ve Uygulamaları', 'Derin Öğrenme ile Doğal Dil İşlemede Duygu Analizi Modellerinin Karşılaştırmalı Analizi']","['2013', '2017']",ozgur_simsek.md,1995,2000,2000,2007,2007,2011,2011,2013,None,,['2013,"2015', '2015-2018', '2018-devam ediyor']"
Ramazan Kaplan,Konya,15.08.1986,39,Atatürk İlkokulu,1993-2000,Meram Anadolu Lisesi,2000-2004,Orta Doğu Teknik Üniversitesi,2004-2008,İşletme,Boğaziçi Üniversitesi,2009-2011,,None,"['Vestel', 'Türk Telekom', 'Turkcell', 'Netronik Teknoloji']","['2011-2014', '2015-2018', '2018-2022', '2022-devam ediyor']",[],[],İstanbul,"['amatör fotoğrafçılık', 'doğa yürüyüşleri', 'trekking', 'yerel lezzetleri keşfetmek']",Elif Kaplan,"['Deniz Kaplan', 'Can Kaplan']","['Teknoloji Odaklı Pazarlama Stratejileri', 'B2B İlişkilerde Güven İnşası']",[],ramazan_kaplan.md,1993,2000,2000,2004,2004,2008,2009,2011,None,,['2011,"2014', '2015-2018', '2018-2022', '2022-devam ediyor']"
Ramazan Yüce,Adana,25.07.1985,40,Seyhan İlkokulu,1991-1999,Adana Fen Lisesi,1999-2003,Orta Doğu Teknik Üniversitesi (ODTÜ),2004-2008,İnşaat Mühendisliği,Boğaziçi Üniversitesi,2008-2010,,None,"['STFA İnşaat A.Ş.', 'T.C. Ulaştırma ve Altyapı Bakanlığı', 'Akıllı Kentler Danışmanlık', 'İzmir Yüksek Teknoloji Enstitüsü']","['2008-2012', '2012-2018', '2018-devam ediyor', '2019-devam ediyor']","['Akıllı Kentler Danışmanlık', 'Türkiye Akıllı Kentler Platformu']","['2018', '2019']",İzmir,"['amatör fotoğrafçılık', 'doğa yürüyüşleri', 'trekking', 'klasik Türk müziği dinlemek', 'bağlama çalmak']",Elif Yüce,"['Can', 'Deniz']","['Akıllı Kent Altyapılarında Veri Entegrasyonu ve Yönetim Modelleri', 'Kentsel Dirençlilik için Siber-Fiziksel Sistemlerin Rolü: İzmir Örneği']","['2020', '2022']",ramazan_yuce.md,1991,1999,1999,2003,2004,2008,2008,2010,None,,['2008,"2012', '2012-2018', '2018-devam ediyor', '2019-devam ediyor']"
Reşat Şimşek,Adana,15.08.1988,36,Adana Borsa İlköğretim Okulu,1994-2002,Adana Anadolu Lisesi,2002-2006,İstanbul Teknik Üniversitesi,2006-2010,Bilgisayar Mühendisliği,Koç Üniversitesi,2010-2012,,None,"['Accenture Türkiye', 'Turkcell', 'Türk Telekom', 'Peak Games', 'PixelForge']","['2010-2012', '2012-2015', '2015-2018', '2018-2021', '2021-devam ediyor']",['PixelForge'],['2021'],İstanbul,"['Dijital İllüstrasyon', 'Masaüstü Rol Yapma Oyunları', 'Amatör Fotoğrafçılık']",Elif Yılmaz,"['Ada', 'Can']","['Optimizing Real-Time Game Engines in Distributed Systems', 'AI-Powered Adaptive Difficulty Scaling in Mobile Gaming']","['2012', '2017']",resat_simsek.md,1994,2002,2002,2006,2006,2010,2010,2012,None,,['2010,"2012', '2012-2015', '2015-2018', '2018-2021', '2021-devam ediyor']"
Rıza Erdoğan,Diyarbakır,05.07.1988,37,Diyarbakır Cumhuriyet İlkokulu,1994-2001,Diyarbakır Fen Lisesi,2001-2005,Koç Üniversitesi,2005-2009,Bilgisayar Mühendisliği,Boğaziçi Üniversitesi,2009-2011,Hacettepe Üniversitesi,2011-2015,"['Hacettepe Üniversitesi', 'Beko Global AR-GE Merkezi', 'Huawei Türkiye']","['2009-2015', '2015-2019', '2019-devam ediyor']",['Türkiye Yapay Zeka Etik Derneği'],['2022'],İstanbul,"['Robotik kodlama', 'Amatör astronomi', 'Gökyüzü gözlemleri', 'Doğa yürüyüşleri', 'Eski Türk filmleri izlemek']",Elif Erdoğan,"['Ada Erdoğan', 'Can Erdoğan']","['Etik Yapay Zeka Sistemlerinde Önyargı Azaltma Yöntemleri: Sosyal Veri Setlerindeki Algoritmik Sapmaların İncelenmesi', 'Derin Öğrenme Modellerinde Şeffaflık ve Açıklanabilirlik İçin Yeni Yaklaşımlar', 'İnsansı Robotik Arayüzlerinde Duygusal Zeka Entegrasyonu: Etik Boyutlar ve Kullanıcı Deneyimi', 'Büyük Veri Analitiğinde Etik İlkelerin Uygulanması: Vaka Çalışmaları ve Öneriler']","['2015', '2017', '2020', '2023']",riza_erdogan.md,1994,2001,2001,2005,2005,2009,2009,2011,2011,2015,['2009,"2015', '2015-2019', '2019-devam ediyor']"
Rukiye Aslan,Adana,12.07.1989,36,Adana Seyhan İlköğretim Okulu,1996-2003,Adana Fen Lisesi,2003-2007,Marmara Üniversitesi,2007-2011,Halkla İlişkiler ve Tanıtım,İstanbul Bilgi Üniversitesi,2012-2014,,None,"['Unilever Türkiye', 'Garanti BBVA', 'PepsiCo Türkiye', 'Gelecek İletişim']","['2014-2017', '2017-2020', '2020-2023', '2023-devam ediyor']",['Gelecek İletişim'],['2023'],İstanbul,"['klasik gitar çalmak', 'doğa fotoğrafçılığı', 'eski film afişleri toplamak', 'yoga']",Can Yılmaz,['Elif'],['Dijital Çağda Marka Aktivizmi ve Tüketici Algısı Üzerine Bir Araştırma'],['2014'],rukiye_aslan.md,1996,2003,2003,2007,2007,2011,2012,2014,None,,['2014,"2017', '2017-2020', '2020-2023', '2023-devam ediyor']"
Şahin Güler,Kayseri,15.03.1988,37,Kayseri Hürriyet İlkokulu,1994-2002,İstanbul Kadıköy Anadolu Lisesi,2002-2006,Orta Doğu Teknik Üniversitesi (ODTÜ),2006-2010,Bilgisayar Mühendisliği,İstanbul Üniversitesi,2013-2015,,None,"['Turkcell', 'Trendyol', 'Türk Telekom', 'Getir']","['2010-2013', '2013-2015', '2015-2018', '2018-devam ediyor']",[],[],İstanbul,"['Amatör fotoğrafçılık', 'yerel tarih araştırmaları']",Aslı Güler,"['Defne Güler', 'Emir Güler']","['Predicting Customer Lifetime Value in Telecommunication Using Ensemble Learning Methods.', 'Dynamic Demand Forecasting for Hyperlocal Delivery Services with Deep Learning.']","['2016', '2020']",sahin_guler.md,1994,2002,2002,2006,2006,2010,2013,2015,None,,['2010,"2013', '2013-2015', '2015-2018', '2018-devam ediyor']"
Şahin Yıldız,İstanbul,15.06.1989,36,Vefa İlköğretim Okulu,1996-2004,Cağaloğlu Anadolu Lisesi,2004-2008,Boğaziçi Üniversitesi,2008-2012,Siyaset Bilimi ve Uluslararası İlişkiler,Koç Üniversitesi,2013-2015,,None,"['PRONEW İletişim Danışmanlığı', 'Garanti BBVA', 'Vodafone Türkiye']","['2012-2014', '2017-2020', '2020-2023']",['Anka İletişim Çözümleri'],['2023'],İstanbul,"['amatör fotoğrafçılık', 'Uzak Doğu mutfaklarını keşfetmek', 'yeni tarifler denemek', 'haftalık yoga seanslarına katılmak', 'siyasi biyografileri takip etmek', 'tarih belgesellerini takip etmek']",Ayşe Aktaş,"['Defne', 'Can']","['Dijital Çağda Kurumsal İtibar Yönetimi: Türk Bankacılık Sektörü Örneği', ""Sürdürülebilirlik İletişiminde Yeni Yaklaşımlar: Türkiye'den Vakalar""]","['2016', '2019']",sahin_yildiz.md,1996,2004,2004,2008,2008,2012,2013,2015,None,,['2012,"2014', '2017-2020', '2020-2023']"
Salih Demir,Kayseri,15.08.1985,40,Kayseri Erciyes İlkokulu,1991-1999,Kayseri Fen Lisesi,1999-2003,Orta Doğu Teknik Üniversitesi,2003-2007,Bilgisayar Mühendisliği,Boğaziçi Üniversitesi,2008-2010,İstanbul Teknik Üniversitesi,2012-2016,"['ASELSAN', 'Huawei Türkiye', 'Vestel', 'Peak Games', 'DeepMind Türkiye']","['2007', '2010-2012', '2016-2019', '2019-2022', '2022-devam ediyor']",['Türkiye Bilişim Derneği Yapay Zeka Etiği Çalışma Grubu'],[],İstanbul,"['Uzun mesafe koşusu', 'Amatör fotoğrafçılık', 'Bilim kurgu kitapları okumak', 'Gitar çalmak']",Ayşe Yılmaz,"['Elif Demir', 'Can Demir']","['Derin Öğrenme Modellerinde Açıklanabilirlik ve Şeffaflık Üzerine Bir Araştırma', 'Mobil Oyunlarda Oyuncu Davranış Analizi için Gelişmiş Makine Öğrenmesi Yaklaşımları', 'Büyük Veri Ortamlarında Güvenli ve Mahremiyet Koruyucu Yapay Zeka Uygulamaları']","['2015', '2021', '2023']",salih_demir.md,1991,1999,1999,2003,2003,2007,2008,2010,2012,2016,"['2007', '2010","2012', '2016-2019', '2019-2022', '2022-devam ediyor']"
Salih Ergin,Mersin,15.06.1982,43,Gazi İlkokulu,1988-1993,Mersin Anadolu Lisesi,1993-2000,Orta Doğu Teknik Üniversitesi (ODTÜ),2000-2004,Şehir ve Bölge Planlama,İstanbul Teknik Üniversitesi (İTÜ),2005-2007,,None,"['Mersin Büyükşehir Belediyesi', 'Siemens Türkiye', 'UrbanTech Danışmanlık']","['2007-2010', '2010-2015', '2015-devam ediyor']","['UrbanTech Danışmanlık', 'Kentimi Yeniden Hayal Et']","['2015', None]",İstanbul,"['dijital fotoğrafçılık', 'şehir yürüyüşleri', 'kentsel dokuyu incelemek', 'gizli kalmış tarihi yerleri keşfetmek', 'maraton koşmak']",Zeynep Yılmaz,"['Elif Ergin', 'Can Ergin']",['Türkiye Kentlerinde Akıllı Şehir Uygulamalarının Sürdürülebilirliği Üzerine Bir Araştırma'],['2014'],salih_ergin.md,1988,1993,1993,2000,2000,2004,2005,2007,None,,['2007,"2010', '2010-2015', '2015-devam ediyor']"
Salih Kara,Antalya,10.05.1983,42,İsmail Cem İlkokulu,1989-1997,Antalya Atatürk Lisesi,1997-2001,Akdeniz Üniversitesi,2001-2005,Çevre Mühendisliği,Ege Üniversitesi,2006-2008,,None,"['Yeşil Çözüm Çevre Danışmanlık A.Ş.', 'Enerji Verimliliği ve Çevre Teknolojileri A.Ş.', 'Pınar Süt A.Ş.']","['2005-2006', '2008-2015', '2015-devam ediyor']",['Ege Çevre Gönüllüleri Derneği'],['2010'],İzmir,"['dağcılık', 'arıcılık', 'yerel tarih araştırmaları']",Ayşe Kara,"['Zeynep Kara', 'Can Kara']","[""Akdeniz Bölgesi'nde Kentsel Atıksu Arıtma Tesislerinin Verimlilik Analizi"", 'İzmir Kentinde Güneş Enerjisi Potansiyeli ve Sürdürülebilir Şehir Planlamasına Entegrasyonu', 'Gıda Sektöründe Döngüsel Ekonomi Uygulamaları ve Sürdürülebilirlik Endeksi Etkisi']","['2005', '2008', '2019']",salih_kara.md,1989,1997,1997,2001,2001,2005,2006,2008,None,,['2005,"2006', '2008-2015', '2015-devam ediyor']"
Salih Polat,Antalya,15.07.1983,42,Atatürk İlkokulu,1989-1997,Antalya Lisesi,1997-2001,Ege Üniversitesi,2001-2005,İstatistik Bölümü,Marmara Üniversitesi,2006-2008,,None,"['BrandSpark Reklam Ajansı', 'Migros', 'Turkcell', 'Garanti BBVA', 'Microsoft Türkiye']","['2005-2007', '2007-2011', '2011-2016', '2017-2020', '2020-devam ediyor']",[],[],İstanbul,"['dijital fotoğrafçılık', 'doğa yürüyüşleri', 'klasik Türk Sanat Müziği', 'Python ile veri projeleri geliştirme', 'yeni teknolojileri denemek']",Ayşe Polat,"['Elif Polat', 'Can Polat']","['E-Ticarette Müşteri Segmentasyonu için Makine Öğrenimi Yaklaşımları Üzerine Bir İnceleme', 'Sosyal Medya Reklamcılığında Hedefleme Optimizasyonu: Bir Vaka Çalışması']","['2015', '2018']",salih_polat.md,1989,1997,1997,2001,2001,2005,2006,2008,None,,['2005,"2007', '2007-2011', '2011-2016', '2017-2020', '2020-devam ediyor']"
Sami Şimşek,İzmir,15.06.1983,42,Bornova İnönü İlkokulu,1989-1997,Bornova Anadolu Lisesi,1997-2001,Ege Üniversitesi,2001-2005,Endüstri Mühendisliği,İstanbul Üniversitesi,2007-2009,,None,"['Loğar Lojistik', 'Anadolu Efes', 'Koç Holding', 'Migros Ticaret A.Ş.']","['2005-2007', '2009-2013', '2013-2017', '2017-devam ediyor']",[],[],İstanbul,"['amatör fotoğrafçılık', 'uzun mesafe koşuları', 'yarı maratonlara katılmak', 'seyahat etmek', 'farklı kültürleri keşfetmek', 'yerel pazarları keşfetmek', 'kitap okumak', 'belgesel izlemek']",Elif Demir,"['Defne', 'Can']","['Perakende Sektöründe Tedarik Zinciri Optimizasyonu Üzerine Bir Vaka Analizi', ""Türkiye'de E-Ticaret Lojistiğinin Geleceği: Son Mil Teslimat Modelleri"", 'Salgın Döneminde Tedarik Zinciri Dayanıklılığı ve Esnekliği']","['2009', '2019', '2021']",sami_simsek.md,1989,1997,1997,2001,2001,2005,2007,2009,None,,['2005,"2007', '2009-2013', '2013-2017', '2017-devam ediyor']"
Sami Yıldız,İzmir,15.07.1985,40,İzmir Özel Bilge Koleji,1991-1999,İzmir Fen Lisesi,2000-2004,Boğaziçi Üniversitesi,2004-2008,Sinema ve Televizyon Bölümü,Marmara Üniversitesi,2009-2011,,None,"['Büyülü Fener Yapım Şirketi', 'NTV Haber Merkezi', 'Türk Telekom', 'Perspektif Film Yapım']","['2009-2013', '2013-2015', '2015-2018', '2022-devam ediyor']",['Perspektif Film Yapım'],['2022'],İstanbul,"['analog fotoğrafçılık', 'uzun doğa yürüyüşleri yapmak', 'caz müziği dinlemek', 'nadir bulunan eski kitapları toplamak']",Elif Yıldız,"['Deniz', 'Eren']","[""Türkiye'de Dijitalleşen Belgesel Sinemanın Toplumsal Etkileri"", 'Sanal Gerçeklik ve Anlatı Teknikleri']","['2011', '2019']",sami_yildiz.md,1991,1999,2000,2004,2004,2008,2009,2011,None,,['2009,"2013', '2013-2015', '2015-2018', '2022-devam ediyor']"
Şebnem Özsoy,Bursa,15.08.1985,40,Hürriyet İlkokulu,1991-1996,Bursa Anadolu Lisesi,1996-2003,Anadolu Üniversitesi,2003-2007,Sinema ve Televizyon Bölümü,İstanbul Bilgi Üniversitesi,2008-2010,,None,"['TRT', 'Med Yapım', 'Anka Yapım']","['2007-2008', '2010-2013', '2013-devam ediyor']",['Anka Yapım'],['2013'],İstanbul,"['doğa yürüyüşleri', 'yeni yerler keşfetmek', 'eski filmleri izlemek', 'yöresel yemek tarifleri denemek', 'analog fotoğrafçılık']",Caner Demir,"['Ada Demir', 'Alp Demir']","['Türk Belgesel Sinemasında Dijitalleşmenin Etkileri ve Gelecek Projeksiyonları', 'Belgesel Sinemada Etik Yaklaşımlar', 'Yeni Medya ve Hikaye Anlatıcılığı']","['2010', '2017', '2021']",sebnem_ozsoy.md,1991,1996,1996,2003,2003,2007,2008,2010,None,,['2007,"2008', '2010-2013', '2013-devam ediyor']"
Sedef Sezer,Adana,07.03.1988,37,Adana Seyhan İlköğretim Okulu,1994-2002,Ankara Fen Lisesi,2002-2006,Orta Doğu Teknik Üniversitesi,2006-2010,Bilgisayar Mühendisliği,Orta Doğu Teknik Üniversitesi,2010-2012,Boğaziçi Üniversitesi,2012-2016,"['Arçelik Ar-Ge Merkezi', 'Marmara Üniversitesi Bilgisayar Mühendisliği Bölümü']","['2017-2019', '2019-devam ediyor']",[],[],İstanbul,"['kitap okumak', 'yoga yapmak', 'dijital fotoğrafçılık', 'müze gezmek', 'doğa yürüyüşleri yapmak']",Emre Sezer,['Defne'],"['Sosyal Medya Verilerinde Politik Duyarlılık Analizi: Türkiye Örneği.', 'Deep Learning Approaches for Turkish Sentiment Analysis in Twitter Data.', 'Evaluating the Impact of AI on Urban Mobility: A Case Study in Istanbul.', 'Ethical Considerations in Big Data Analysis: A Turkish Perspective.']","['2015', '2016', '2020', '2022']",sedef_sezer.md,1994,2002,2002,2006,2006,2010,2010,2012,2012,2016,['2017,"2019', '2019-devam ediyor']"
Selin Acar,Bursa,15.06.1988,37,Namık Kemal İlkokulu,1994-2002,Bursa Anadolu Lisesi,2002-2006,Boğaziçi Üniversitesi,2006-2010,İletişim Bilimleri,Koç Üniversitesi,2011-2013,,None,"['Mindshare Türkiye', 'Unilever Türkiye', 'Arçelik A.Ş.', 'Getir', 'Acar Dijital Stratejiler']","['2010-2013', '2013-2015', '2015-2018', '2018-2022', '2022-devam ediyor']",['Acar Dijital Stratejiler'],['2022'],İstanbul,"['yoga yapmak', 'doğa yürüyüşlerine çıkmak', 'dijital sanatlarla ilgilenmek', ""pazarlama ve teknoloji alanındaki podcast'leri dinlemek"", 'yeni şehirler ve kültürler keşfetmek için seyahat etmek']",Can Yılmaz,"['Ela Acar Yılmaz', 'Demir Acar Yılmaz']",['Dijital Çağda Tüketici Güveni ve Marka Algısı Üzerine Bir Araştırma'],['2013'],selin_acar.md,1994,2002,2002,2006,2006,2010,2011,2013,None,,['2010,"2013', '2013-2015', '2015-2018', '2018-2022', '2022-devam ediyor']"
Semra Eren,Antalya,15.08.1983,42,Antalya Cumhuriyet İlkokulu,1989-1997,İzmir Bornova Anadolu Lisesi,1997-2001,Boğaziçi Üniversitesi,2001-2005,Sanat Tarihi ve Arkeoloji Bölümü,Koç Üniversitesi,2005-2007,İstanbul Üniversitesi,2008-2012,"['İstanbul Üniversitesi Edebiyat Fakültesi', 'Pera Müzesi', 'T.C. Kültür ve Turizm Bakanlığı Kültürel Miras Genel Müdürlüğü', 'Adana Arkeoloji Müzesi', 'Bağımsız Kültür Danışmanı ve Proje Yöneticisi']","['2008-2012', '2012-2015', '2015-2019', '2019-2023', '2023-devam ediyor']",[],[],İstanbul,"['doğa yürüyüşleri', 'tarihi yapıların fotoğraflarını çekmek', 'yöresel yemek tarifleri denemek']",Efe Demir,"['Ada Demir', 'Can Demir']","[""Anadolu'daki Roma Dönemi Mozaik Sanatının Korunması Üzerine Bir Araştırma"", 'Kent Müzeleşmesi ve Katılımcı Yönetim Modelleri: İstanbul Örneği', ""Türkiye'de Dijital Müze Deneyimleri: Potansiyel ve Engeller"", 'Geçmişin Koruyucusu, Geleceğin Yorumlayıcısı: Müzeciliğin Sosyal Rolü']","['2007', '2012', '2016', '2019']",semra_eren.md,1989,1997,1997,2001,2001,2005,2005,2007,2008,2012,['2008,"2012', '2012-2015', '2015-2019', '2019-2023', '2023-devam ediyor']"
Semra Türkmen,Kayseri,05.09.1987,38,Kayseri Mustafa Kemal İlkokulu,1993-2000,Kayseri Fen Lisesi,2000-2004,Bilkent Üniversitesi,2004-2008,Hukuk Fakültesi,İstanbul Bilgi Üniversitesi,2009-2011,,None,"['ABC Hukuk Bürosu', 'Erdem & Erdem Hukuk Bürosu', 'Garanti BBVA', 'LexIntel Hukuk Bürosu']","['2008-2009', '2011-2016', '2017-2020', '2020-devam ediyor']",['LexIntel Hukuk Bürosu'],['2020'],İstanbul,"['doğa yürüyüşleri', 'yoga', 'eski Türk filmlerini izlemek', 'dijital sanat sergilerini takip etmek', 'kısa öyküler yazmak']",Can Demir,"['Elif', 'Alp']","['Dijital Kimlik ve Veri Mahremiyeti Hukukunda Yeni Yaklaşımlar', 'Yapay Zeka Destekli Karar Mekanizmalarının Hukuki Sorumluluğu: Güncel Tartışmalar ve Gelecek Perspektifleri']","['2015', '2019']",semra_turkmen.md,1993,2000,2000,2004,2004,2008,2009,2011,None,,['2008,"2009', '2011-2016', '2017-2020', '2020-devam ediyor']"
Serap Arslan,Bursa,05.07.1989,36,Hamitler İlkokulu,1995-2000,Bursa Anadolu Lisesi,2000-2007,Orta Doğu Teknik Üniversitesi,2007-2011,İstatistik,Koç Üniversitesi,2011-2013,,None,"['Arçelik A.Ş.', 'SAP Türkiye', 'Trendyol']","['2013-2016', '2016-2020', '2020-devam ediyor']",[],[],İstanbul,"['doğa yürüyüşleri', 'yoga', 'strateji tabanlı masa oyunları', 'kişisel kodlama projeleri', 'kitap okumak']",Can Aydemir,"['Elif Aydemir', 'Bora Aydemir']","['Büyük Veri Analitiğinde Makine Öğrenmesi Yaklaşımları: Perakende Sektörü Uygulamaları', 'Müşteri Segmentasyonu için Gelişmiş Kümeleme Algoritmaları ve Uygulamaları']","['2013', '2018']",serap_arslan.md,1995,2000,2000,2007,2007,2011,2011,2013,None,,['2013,"2016', '2016-2020', '2020-devam ediyor']"
Serpil Ergin,Adana,18.06.1983,42,Adana Cumhuriyet İlköğretim Okulu,1990-1998,Adana Fen Lisesi,1998-2002,Boğaziçi Üniversitesi,2003-2007,Sanat Tarihi,İstanbul Üniversitesi,2008-2010,,None,"['İstanbul Modern Sanat Müzesi', 'SALT Galata', 'Bağımsız Küratör ve Kültür Danışmanı', 'Kültürel Mirasın Sesleri Derneği']","['2007-2010', '2010-2014', '2014-devam ediyor', '2017-devam ediyor']",['Kültürel Mirasın Sesleri Derneği'],['2017'],İstanbul,"['hat sanatı koleksiyonculuğu', 'geleneksel Türk mutfağı araştırmaları', 'yeni tarifler denemek', 'Anadolu şehirlerinde kısa şehir gezileri yaparak yerel kültürleri deneyimlemek']",Can Demir,"['Ada', 'Ege']","['Osmanlı Dönemi Hat Sanatında Kadın Sanatçılar Üzerine Bir İnceleme', 'Modern Türk Sanatında Geleneksel Motiflerin Yeri: Sürdürülebilir Bir Bakış Açısı']","['2016', '2019']",serpil_ergin.md,1990,1998,1998,2002,2003,2007,2008,2010,None,,['2007,"2010', '2010-2014', '2014-devam ediyor', '2017-devam ediyor']"
Serra Çakır,Adana,15.08.1990,35,Adana 23 Nisan İlkokulu,1996-2004,Adana Anadolu Lisesi,2004-2008,Hacettepe Üniversitesi,2008-2012,Bilgisayar Mühendisliği,Boğaziçi Üniversitesi,2012-2014,,None,"['TurkNet', 'Getir', 'FutureTech Enstitüsü']","['2014-2016', '2016-2020', '2020-devam ediyor']",[],[],İstanbul,"['doğa yürüyüşleri', 'fotoğraf çekmek', 'bağlama çalmak', 'kitap okumak']",Can Yılmaz,"['Ada', 'Deniz']","['Turkish Sentiment Analysis Using Deep Learning Architectures', 'Predictive Modeling for On-Demand Delivery Services: A Machine Learning Approach', 'Algorithmic Bias Detection and Mitigation Strategies in AI-Driven Decision Making']","['2014', '2019', '2022']",serra_cakir.md,1996,2004,2004,2008,2008,2012,2012,2014,None,,['2014,"2016', '2016-2020', '2020-devam ediyor']"
Sevda Toprak,Ankara,15.08.1986,39,Ankara Atatürk İlkokulu,1992-1997,Ankara Anadolu Lisesi,1997-2004,Orta Doğu Teknik Üniversitesi,2004-2008,Şehir ve Bölge Planlama,Yıldız Teknik Üniversitesi,2010-2012,,None,"['Ankara Büyükşehir Belediyesi', 'Kentsel Gelişim A.Ş.', 'Şehir Vizyon Danışmanlık']","['2008-2012', '2012-2017', '2017-devam ediyor']","['Şehir Vizyon Danışmanlık', 'Sürdürülebilir Şehirler Derneği']","['2017', '2019']",İstanbul,"['kentsel fotoğrafçılık', 'nadir ve eski şehir haritaları koleksiyonculuğu', 'doğa yürüyüşleri', 'piyano çalmak']",Mert Yılmaz,"['Defne', 'Can']","['Akıllı Şehirlerde Veri Odaklı Planlama: İstanbul Örneği', 'Kentsel Dönüşümde Sosyal Etki Değerlendirmesi ve Katılımcılık']","['2019', '2021']",sevda_toprak.md,1992,1997,1997,2004,2004,2008,2010,2012,None,,['2008,"2012', '2012-2017', '2017-devam ediyor']"
Sevda Yıldırım,Gaziantep,15.06.1985,40,Gaziantep Nuri Paşa İlkokulu,1991-1996,Gaziantep Vehbi Dinçerler Fen Lisesi,1996-2000,Marmara Üniversitesi,2000-2004,Gazetecilik,Boğaziçi Üniversitesi,2006-2008,,None,"['Doğan Haber Ajansı', 'TRT Belgesel Kanalı', 'Anadolu Ajansı']","['2004-2006', '2008-2012', '2015-2018']","[""Anadolu'nun Yüzleri"", 'Kültür Köprüleri Derneği']","['2012', '2015']",İstanbul,"['Doğa yürüyüşleri yapmak', 'Eski filmleri izlemek', 'Geleneksel Türk el sanatları üzerine araştırmalar yapmak', 'Fotoğrafçılık']",Can Demir,"['Elif Demir', 'Emre Demir']","[""Türkiye'de Belgesel Sinemanın Gelişimi ve Toplumsal Etkileri""]",['2014'],sevda_yildirim.md,1991,1996,1996,2000,2000,2004,2006,2008,None,,['2004,"2006', '2008-2012', '2015-2018']"
