ad,dogum_yeri,dogum_tarihi,yas,ilkokul,ilkokul_yillari,lise,lise_yillari,universite,universite_yillari,bolum,yuksek_lisans,yuksek_lisans_yillari,doktora,doktora_yillari,calistigi_kurumlar,calisma_yillari,kurdugu_girisim_ve_dernekler,girisim_kurulus_yillari,yasadigi_sehir,hobiler,es,cocuklar,akademik_yayinlar,yayin_yillari,dosya_adi,ilkokul_yillari_baslangic,ilkokul_yillari_bitis,lise_yillari_baslangic,lise_yillari_bitis,universite_yillari_baslangic,universite_yillari_bitis,yuksek_lisans_yillari_baslangic,yuksek_lisans_yillari_bitis,doktora_yillari_baslangic,doktora_yillari_bitis,calisma_yillari_baslangic,calisma_yillari_bitis
İskender Kara,Ankara,15.06.1989,36,Ankara Dikmen İlkokulu,1995-2000,Ankara Atatürk Lisesi,2003-2007,Orta Doğu Teknik Üniversitesi (ODTÜ),2007-2011,Bilgisayar Mühendisliği,Marmara Üniversitesi,2012-2014,,None,"['Innova Bilişim Çözümleri A.Ş.', 'Siemens Türkiye', 'Türk Telekom', 'Akbank', 'FinanSmart Teknoloji A.Ş.']","['2011-2013', '2013-2015', '2015-2018', '2018-2022', '2022-devam ediyor']",[],[],İstanbul,"['bisiklete binmek', 'doğa fotoğrafçılığı', 'stratejik masa oyunları oynamak', 'tarihi romanlar okumak', 'belgesel izlemek']",Ayşe Yılmaz,"['Defne Kara', 'Emre Kara']","['Finans Sektöründe Blockchain Tabanlı Siber Güvenlik Yaklaşımları', 'Büyük Veri Ortamlarında Anormal Ağ Davranışlarının Tespiti', 'Yapay Zeka Destekli Siber Tehdit İstihbaratı Sistemleri Üzerine Bir İnceleme']","['2014', '2017', '2020']",i̇skender_kara.md,1995,2000,2003,2007,2007,2011,2012,2014,None,,['2011,"2013', '2013-2015', '2015-2018', '2018-2022', '2022-devam ediyor']"
İsmail Aktaş,Diyarbakır,15.06.1985,40,Ziya Gökalp İlkokulu,1991-1996,Diyarbakır Süleyman Demirel Anadolu Lisesi,1996-2003,İstanbul Teknik Üniversitesi,2005-2009,Bilgisayar Mühendisliği,Koç Üniversitesi,2010-2012,,None,"['Siemens Türkiye', 'Turkcell', 'Garanti BBVA', 'Akbank']","['2007-2010', '2012-2017', '2017-2020', '2020-devam ediyor']",[],[],İstanbul,"['amatör fotoğrafçılık', 'doğa yürüyüşleri', 'drone teknolojileri', 'yerel lezzetleri keşfetmek']",Ayşe Aktaş,"['Elif Aktaş', 'Can Aktaş']",['Türkiye Şehirlerinde Akıllı Ulaşım Sistemleri için Veri Madenciliği Yaklaşımları'],['2012'],i̇smail_aktas.md,1991,1996,1996,2003,2005,2009,2010,2012,None,,['2007,"2010', '2012-2017', '2017-2020', '2020-devam ediyor']"
İsmail Eren,Kayseri,15.06.1986,39,Ahmet Paşa İlköğretim Okulu,1993-2000,Kayseri Fen Lisesi,2000-2004,Orta Doğu Teknik Üniversitesi (ODTÜ),2004-2008,Psikoloji,Hacettepe Üniversitesi,2008-2010,,None,"['Turkcell', 'Koç Holding', 'Emlakjet', 'İnsan Verisi Lab']","['2010-2013', '2013-2017', '2017-2021', '2021-devam ediyor']",['İnsan Verisi Lab'],['2021'],İstanbul,"['uzun mesafe koşu', 'maratonlara katılma', 'klasik Türk müziği dinleme', 'yapay zeka ile etik arasındaki kesişim noktalarını konu alan araştırmaları takip etme', 'doğa yürüyüşleri yapma', 'fotoğrafçılık']",Elif Hanım,"['Cem Eren', 'Defne Eren']","['Dijitalleşen İş Gücünde Çalışan Bağlılığı ve Teknolojinin Rolü', 'Veriye Dayalı Karar Alma Süreçlerinde Örgütsel Psikolojinin Etkisi', 'Yapay Zeka Destekli İnsan Kaynakları Sistemlerinde Etik Yaklaşımlar']","['2010', '2018', '2022']",i̇smail_eren.md,1993,2000,2000,2004,2004,2008,2008,2010,None,,['2010,"2013', '2013-2017', '2017-2021', '2021-devam ediyor']"
İsmail Güneş,Ankara,15.08.1990,35,Mimar Sinan İlkokulu,1996-2004,Ankara Atatürk Lisesi,2004-2008,Boğaziçi Üniversitesi,2008-2012,İşletme,London School of Economics (LSE),2013-2014,,None,"['PwC Türkiye', 'Garanti BBVA', 'Deutsche Bank Türkiye', 'Güneş Finans Danışmanlık']","['2012-2013', '2015-2020', '2020-2023', '2023-devam ediyor']",['Güneş Finans Danışmanlık'],['2023'],İstanbul,"['maraton koşmak', 'klasik gitar çalmak', 'dijital sanat koleksiyonculuğu', 'dünya haritaları incelemek', 'farklı kültürlerin finansal yapılarını araştırmak']",Ayşe Güneş,['Zeynep'],[],[],i̇smail_gunes.md,1996,2004,2004,2008,2008,2012,2013,2014,None,,['2012,"2013', '2015-2020', '2020-2023', '2023-devam ediyor']"
İsmail Uçar,Gaziantep,05.08.1986,39,Necip Fazıl Kısakürek İlkokulu,1992-2000,Gaziantep Fen Lisesi,2000-2004,Orta Doğu Teknik Üniversitesi,2004-2008,Şehir ve Bölge Planlama Bölümü,Orta Doğu Teknik Üniversitesi,2008-2010,,None,"['Ankara Büyükşehir Belediyesi, Kentsel Dönüşüm Dairesi Başkanlığı', 'Kentsel Vizyon Planlama Danışmanlık A.Ş.', 'BM-Habitat Türkiye']","['2010-2015', '2015-2020', '2020-devam ediyor']",['Herkes İçin Yaşanabilir Kentler Derneği'],[],Ankara,"['kentsel fotoğrafçılık', 'eski haritalar ve şehir planları koleksiyonculuğu', 'doğa yürüyüşleri', 'ahşap oymacılığı']",Ayşe Demir,"['Elif', 'Can']","['Kentsel Dönüşüm Süreçlerinde Toplumsal Katılımın Önemi: Ankara Örneği', 'Tarihi Kent Dokularında Koruma ve Geliştirme Yaklaşımları', 'İklim Değişikliğine Dirençli Kentler: Kentsel Planlama Perspektifinden Yaklaşımlar']","['2010', '2017', '2022']",i̇smail_ucar.md,1992,2000,2000,2004,2004,2008,2008,2010,None,,['2010,"2015', '2015-2020', '2020-devam ediyor']"
İzzet Arslan,Ankara,15.08.1988,37,Çankaya Mehmet Tunç İlkokulu,1994-2002,Ankara Fen Lisesi,2002-2006,Orta Doğu Teknik Üniversitesi (ODTÜ),2007-2011,Siyaset Bilimi ve Kamu Yönetimi,Boğaziçi Üniversitesi,2012-2014,,None,"['TESEV (Türkiye Ekonomik ve Sosyal Etüdler Vakfı)', 'Garanti BBVA', 'Türkiye Belediyeler Birliği']","['2014-2016', '2017-2020', '2020-devam ediyor']",['Şehir Gönüllüleri Derneği'],['2016'],Ankara,"['Amatör Fotoğrafçılık', 'Şehir Tarihi Araştırmaları', 'Doğa Yürüyüşleri', 'Podcast Dinlemek']",Zeynep Arslan,"['Defne', 'Can']","['Yerel Yönetimlerde Dijital Katılımcılık: Türkiye Örneği', 'Kentsel Dönüşüm ve Aidiyet Duygusu: İstanbul Analizi']","['2018', '2015']",i̇zzet_arslan.md,1994,2002,2002,2006,2007,2011,2012,2014,None,,['2014,"2016', '2017-2020', '2020-devam ediyor']"
İzzet Özkan,Kayseri,15.06.1986,39,Kayseri Kadı Burhaneddin İlköğretim Okulu,1993-2000,Kayseri Fen Lisesi,2000-2004,Orta Doğu Teknik Üniversitesi,2004-2008,Endüstri Mühendisliği,Bilkent Üniversitesi,2009-2011,,None,"['EY Türkiye', 'Akbank', 'Garanti BBVA', 'Paraşüt']","['2011-2014', '2014-2017', '2017-2020', '2020-devam ediyor']",[],[],İstanbul,"['amatör fotoğrafçılık', 'sokak fotoğrafçılığı', 'doğa yürüyüşleri', 'klasik müzik dinlemek', 'satranç']",Ayşe Özkan,"['Elif Özkan', 'Can Özkan']","['Türkiye Bankacılık Sektöründe Kredi Riski Tahmininde Makine Öğrenmesi Modellerinin Uygulanması', 'Büyük Veri ile Finansal Dolandırıcılık Tespiti: Bir Vaka Çalışması']","['2011', '2018']",i̇zzet_ozkan.md,1993,2000,2000,2004,2004,2008,2009,2011,None,,['2011,"2014', '2014-2017', '2017-2020', '2020-devam ediyor']"
İzzet Yalçın,Kayseri,15.08.1988,37,Kayseri Erciyes İlköğretim Okulu,1994-2002,Kayseri Lisesi,2002-2006,Ankara Üniversitesi,2006-2010,Halkla İlişkiler ve Tanıtım,Galatasaray Üniversitesi,2010-2012,,None,"['Arçelik', 'Turkcell', 'Coca-Cola Türkiye', 'Vizyon Dijital Ajans']","['2012-2016', '2016-2019', '2019-2022', '2022-devam ediyor']",['Vizyon Dijital Ajans'],['2022'],İstanbul,"['sokak fotoğrafçılığı', ""Anadolu'nun farklı yörelerini ziyaret ederek kültürel dokuyu belgelemek"", 'bağlama çalmak', 'bisiklet sürmek', 'dijital sanatlar ve NFT teknolojileri üzerine araştırmalar yapmak']",Ayşe Deniz,"['Ela', 'Can']","['Marka Hikayeciliğinin Tüketici Bağlılığına Etkisi: Dijital Platformlar Üzerine Bir Araştırma', 'Yapay Zeka Destekli İçerik Pazarlamasında Etik Yaklaşımlar']","['2013', '2021']",i̇zzet_yalcin.md,1994,2002,2002,2006,2006,2010,2010,2012,None,,['2012,"2016', '2016-2019', '2019-2022', '2022-devam ediyor']"
İzzet Yıldız,Kayseri,15.06.1985,40,Kayseri Atatürk İlköğretim Okulu,1991-1999,Kayseri Fen Lisesi,1999-2003,Orta Doğu Teknik Üniversitesi,2003-2007,Endüstri Mühendisliği,Boğaziçi Üniversitesi,2010-2012,,None,"['Koç Holding', 'Vestel', 'Migros', 'ParaYol']","['2007-2010', '2010-2013', '2013-2017', '2017-devam ediyor']",['ParaYol'],['2017'],İstanbul,"['Dağ yürüyüşü', 'Satranç', 'Klasik müzik dinlemek', 'Finansal teknolojiler üzerine blog yazıları yazmak', 'Yeni çıkan teknolojik ürünleri takip etmek']",Elif Yıldız,"['Defne', 'Can']","['Blokzincir Teknolojisinin Geleneksel Bankacılığa Etkileri', ""Türkiye'de Dijital Bankacılık ve Kapsayıcılık: ParaYol Vakası""]","['2018', '2021']",i̇zzet_yildiz.md,1991,1999,1999,2003,2003,2007,2010,2012,None,,['2007,"2010', '2010-2013', '2013-2017', '2017-devam ediyor']"
Kaan Arslan,Adana,23.07.1987,38,Adana Atatürk İlköğretim Okulu,1993-2001,Adana Fen Lisesi,2001-2005,Boğaziçi Üniversitesi,2008-2012,Hukuk Fakültesi,İstanbul Üniversitesi,2013-2015,,None,"['Günay & Partners Hukuk Bürosu', 'Akarsu & Özmen Hukuk Bürosu', 'Yıldız Holding A.Ş.', 'K&M Hukuk Bürosu']","['2012-2013', '2015-2018', '2018-2022', '2022-devam ediyor']",['K&M Hukuk Bürosu'],['2022'],İstanbul,"['Yelken', 'Dijital Fotoğrafçılık', 'Klasik Müzik']",Ayşe Arslan,"['Deniz Arslan', 'Cem Arslan']","['Dijital Çağda Fikri Mülkiyet Haklarının Korunması ve Blockchain Teknolojisinin Rolü', 'E-ticarette Tüketici Hakları ve Veri Koruma Mevzuatı Uyum Süreçleri']","['2014', '2020']",kaan_arslan.md,1993,2001,2001,2005,2008,2012,2013,2015,None,,['2012,"2013', '2015-2018', '2018-2022', '2022-devam ediyor']"
Kaan Baran,Eskişehir,14.07.1985,40,Dr. Halil Akkurt İlköğretim Okulu,1991-1999,Ankara Fen Lisesi,2002-2006,Ankara Üniversitesi Veteriner Fakültesi,2006-2011,Veteriner Hekimliği,Hacettepe Üniversitesi,2012-2014,,None,"['Özel Veteriner Kliniği', 'WWF Türkiye', 'T.C. Tarım ve Orman Bakanlığı, Doğa Koruma ve Milli Parklar Genel Müdürlüğü']","['2011-2012', '2014-2018', '2018-devam ediyor']",['Doğa Koruyucuları Ağı'],['2016'],Ankara,"['doğa fotoğrafçılığı', 'kuş fotoğrafçılığı', 'kamp yapmak', 'yürüyüşe çıkmak', 'kuş gözlemciliği', 'belgesel izlemek', 'doğa kitapları okumak']",Ada Baran,"['Deniz Baran', 'Toprak Baran']","['Sulak Alan Ekosistemlerinde Kuş Sağlığının Biyogösterge Olarak Kullanılması', 'Anadolu Leoparı Koruma Stratejileri ve Genetik Çeşitlilik Analizi', ""İklim Değişikliğinin Türkiye'deki Göçmen Kuş Yollarına Etkisi""]","['2014', '2017', '2020']",kaan_baran.md,1991,1999,2002,2006,2006,2011,2012,2014,None,,['2011,"2012', '2014-2018', '2018-devam ediyor']"
Kaan Güneş,Bursa,05.07.1987,38,Bursa Cumhuriyet İlkokulu,1993-2000,Bursa Hürriyet Anadolu Lisesi,2000-2004,Orta Doğu Teknik Üniversitesi (ODTÜ),2004-2008,Bilgisayar Mühendisliği,Koç Üniversitesi,2008-2010,,None,"['ASELSAN', 'Microsoft Türkiye', 'TechNova Girişim']","['2010-2014', '2014-2018', '2018-devam ediyor']",['TechNova'],['2018'],İstanbul,"['Drone Fotoğrafçılığı', 'Maket Uçak Yapımı', 'Doğa Yürüyüşleri', 'Amatör Yazılım Geliştirme Topluluklarına Katılma']",Elif Güneş,"['Defne Güneş', 'Can Güneş']",['Yapay Zeka Destekli Otonom Drone Sistemlerinde Güvenlik Protokolleri'],['2013'],kaan_gunes.md,1993,2000,2000,2004,2004,2008,2008,2010,None,,['2010,"2014', '2014-2018', '2018-devam ediyor']"
Kaan Özdemir,Ankara,15.03.1985,40,Anıttepe İlkokulu,1991-1996,Ankara Fen Lisesi,2000-2004,Orta Doğu Teknik Üniversitesi (ODTÜ),2004-2008,Siyaset Bilimi ve Kamu Yönetimi,İstanbul Bilgi Üniversitesi,2008-2010,,None,"['Migros Ticaret A.Ş.', 'Pegasus Hava Yolları', 'Türk Telekom', 'Yemeksepeti']","['2010-2013', '2013-2015', '2015-2018', '2018-2023']",['Dijital Köprü Medya ve İletişim Ajansı'],['2023'],İstanbul,"['Amatör Fotoğrafçılık', 'Podcast Dinleme ve Üretme', 'Doğa Yürüyüşleri', 'Kişisel Gelişim Kitapları Okumak']",Elif Özdemir,"['Ada Özdemir', 'Can Özdemir']","[""Türkiye'de Kurumsal İletişimin Dijitalleşme Sürecine Adaptasyonu ve Karşılaşılan Zorluklar"", 'Veri Odaklı Pazarlama Yaklaşımlarının Tüketici Davranışları Üzerindeki Etkisi']","['2017', '2020']",kaan_ozdemir.md,1991,1996,2000,2004,2004,2008,2008,2010,None,,['2010,"2013', '2013-2015', '2015-2018', '2018-2023']"
Kaan Yılmaz,Kayseri,15.08.1989,36,Erciyes İlköğretim Okulu,1995-2003,Kayseri Fen Lisesi,2003-2007,Ege Üniversitesi,2007-2011,Halkla İlişkiler ve Tanıtım,Galatasaray Üniversitesi,2012-2014,,None,"['PR-X İletişim Danışmanlığı', 'Hepsiburada.com', 'Yapı Kredi Bankası', 'McCann Istanbul']","['2011-2012', '2014-2016', '2016-2019', '2019-2022']",['İçerik Atölyesi'],['2022'],İstanbul,"['amatör fotoğrafçılık', 'seyahat etmek', ""tarih ve bilim konulu podcast'ler dinlemek"", 'masa tenisi oynamak']",Elif,['Defne'],['Yeni Nesil Medyada Etkileşim ve Katılımcılık: Marka İçeriklerinin Tüketici Algısı Üzerine Etkisi'],['2014'],kaan_yilmaz.md,1995,2003,2003,2007,2007,2011,2012,2014,None,,['2011,"2012', '2014-2016', '2016-2019', '2019-2022']"
Kadir Altun,Ankara,15.07.1989,36,Seyranbağları İlkokulu,1996-2003,Ankara Atatürk Anadolu Lisesi,2003-2007,Orta Doğu Teknik Üniversitesi (ODTÜ),2007-2011,Şehir ve Bölge Planlama,İstanbul Teknik Üniversitesi (İTÜ),2012-2014,,None,"['Ankara Büyükşehir Belediyesi, İmar ve Şehircilik Daire Başkanlığı', 'ERA Gayrimenkul Geliştirme A.Ş.', 'Kentvizyon Danışmanlık']","['2011-2015', '2015-2018', '2018-devam ediyor']",['Kentvizyon Danışmanlık'],['2018'],İstanbul,"['şehir fotoğrafçılığı', 'bisikletle şehir turları yapmak', 'yerel tarih araştırmaları yapmak', 'klasik gitar çalmak']",Ayşe Altun,"['Defne', 'Can']","['Kentsel Kimlik ve Katılımcı Planlama: Ankara Örneği', 'Sürdürülebilir Kent Gelişiminde Yeşil Altyapı Stratejileri']","['2016', '2021']",kadir_altun.md,1996,2003,2003,2007,2007,2011,2012,2014,None,,['2011,"2015', '2015-2018', '2018-devam ediyor']"
Kemal Can,Kayseri,15.08.1989,36,Melikgazi Atatürk İlkokulu,1995-2000,Nuh Mehmet Baldöktü Anadolu Lisesi,2000-2007,Orta Doğu Teknik Üniversitesi,2007-2011,İktisat,İstanbul Bilgi Üniversitesi,2013-2015,,None,"['TEPAV', 'Garanti BBVA', 'Getir']","['2011-2013', '2015-2019', '2019-devam ediyor']",['Veri Gönüllüleri'],[],İstanbul,"['Amatör fotoğrafçılık', 'Trekking', 'Veri görselleştirme sanatı', 'Drone teknolojilerini takip etmek', 'Mentorluk yapmak']",Ayşe Can,"['Deniz', 'Can']",['Kentleşme ve Dijitalleşmenin Sosyal Etkileri Üzerine Bir Analiz'],['2014'],kemal_can.md,1995,2000,2000,2007,2007,2011,2013,2015,None,,['2011,"2013', '2015-2019', '2019-devam ediyor']"
Levent Ermiş,Denizli,14.09.1986,39,Denizli Hürriyet İlkokulu,1992-1997,Denizli Lisesi,2000-2004,Orta Doğu Teknik Üniversitesi (ODTÜ),2004-2008,Şehir ve Bölge Planlama Bölümü,ODTÜ,2008-2010,,None,"['Ankara Büyükşehir Belediyesi', 'Ege Bölgesi Sanayi Odası (EBSO) Danışmanlık A.Ş.', 'KentVizyon Araştırma ve Danışmanlık']","['2010-2013', '2013-2017', '2017-devam ediyor']",['KentVizyon Araştırma ve Danışmanlık'],['2017'],İzmir,"['bisikletle keşfetmek', 'kentsel peyzaj fotoğrafçılığı', 'bağcılık', 'şarapçılık', 'doğa yürüyüşleri', 'yerel topluluk etkinliklerine katılmak']",Elif,"['Can', 'Defne']","['Sürdürülebilir Kentleşmede Toplu Taşıma Entegrasyonunun Rolü: İzmir Örneği', 'Yeşil Altyapı Planlamasında Katılımcı Yaklaşımların Etkinliği', 'Akıllı Kent Teknolojilerinin Kentsel Dirençliliğe Katkıları']","['2010', '2017', '2021']",levent_ermis.md,1992,1997,2000,2004,2004,2008,2008,2010,None,,['2010,"2013', '2013-2017', '2017-devam ediyor']"
Mahir Koç,Adana,14.07.1989,36,Adana Yavuzlar İlköğretim Okulu,1996-2004,Adana Anadolu Lisesi,2004-2008,Orta Doğu Teknik Üniversitesi (ODTÜ),2007-2011,Bilgisayar Mühendisliği,Boğaziçi Üniversitesi,2012-2014,,None,"['IBM Türkiye', 'Turkcell', 'Google Türkiye']","['2014-2017', '2017-2021', '2021-devam ediyor']",['Veri Etiği Topluluğu'],[],İstanbul,"[""İstanbul'u keşfetmek"", 'fotoğraf çekmek', 'doğa yürüyüşleri', 'stratejik masa oyunları oynamak', 'klasik gitar çalmak']",Elif Yılmaz,"['Defne', 'Can']","['Yapısal Eşitsizliklerin Makine Öğrenimi Algoritmalarına Yansıması: Adillik ve Şeffaflık Yaklaşımları', 'Büyük Veri Ortamlarında Kişisel Veri Gizliliğinin Korunması Üzerine Bir İnceleme ve Yeni Yaklaşımlar']","['2019', '2020']",mahir_koc.md,1996,2004,2004,2008,2007,2011,2012,2014,None,,['2014,"2017', '2017-2021', '2021-devam ediyor']"
Mahmut Aksoy,Ankara,15.06.1983,42,Ankara Yenimahalle İlkokulu,1989-1994,Ankara Atatürk Lisesi,1994-2001,Bilkent Üniversitesi,2001-2005,İşletme,Boğaziçi Üniversitesi,2005-2008,,None,"['Unilever Türkiye', 'Arçelik', 'Turkcell', 'Aksoy Danışmanlık']","['2005-2008', '2008-2016', '2016-2021', '2021-devam ediyor']",['Aksoy Danışmanlık'],['2021'],İstanbul,"['amatör fotoğrafçılık', 'eski Türk filmleri koleksiyonculuğu', 'bisiklet sürmek']",Elif Demirağ,"['Aslı', 'Can']","['Yeni Nesil Tüketici Davranışlarında Dijital Pazarlama Stratejilerinin Rolü', 'Yapay Zeka Destekli Pazarlamada Etik Yaklaşımlar']","['2008', '2022']",mahmut_aksoy.md,1989,1994,1994,2001,2001,2005,2005,2008,None,,['2005,"2008', '2008-2016', '2016-2021', '2021-devam ediyor']"
Mahmut Karaca,Gaziantep,15.07.1983,42,Özel Sanko İlköğretim Okulu,1989-1997,Gaziantep Anadolu Lisesi,1997-2001,Mimar Sinan Güzel Sanatlar Üniversitesi,2001-2005,Şehir ve Bölge Planlama Bölümü,Yıldız Teknik Üniversitesi,2006-2008,,None,"['Arkas Mimarlık ve Planlama', 'İstanbul Büyükşehir Belediyesi', 'Şehir Vizyon Danışmanlık A.Ş.']","['2008-2012', '2012-2018', '2018-devam ediyor']",['Şehir Vizyon Danışmanlık A.Ş.'],['2018'],İstanbul,"['fotoğraf çekmek', 'doğa yürüyüşleri yapmak', 'eski haritalar ve şehir planları toplamak']",Zeynep Karaca,"['Deniz', 'Cem']","['Sürdürülebilir Kentsel Dönüşümde Yerel Yönetimlerin Rolü', 'Tarihi Dokunun Korunmasında Mekansal Stratejiler: Bir Analiz']","['2015', '2019']",mahmut_karaca.md,1989,1997,1997,2001,2001,2005,2006,2008,None,,['2008,"2012', '2012-2018', '2018-devam ediyor']"
Melek Aksoy,Ankara,20.07.1988,37,Çankaya Mehmetçik İlkokulu,1994-2002,Ankara Fen Lisesi,2002-2006,Orta Doğu Teknik Üniversitesi (ODTÜ),2007-2011,Siyaset Bilimi ve Kamu Yönetimi,Boğaziçi Üniversitesi,2012-2014,,None,"['Bilkent Üniversitesi İletişim Fakültesi', 'Medya Atölyesi', 'Türk Telekom A.Ş.', 'Gerçek Gözüyle Prodüksiyon']","['2011-2012', '2014-2015', '2015-2018', '2018-devam ediyor']","['Gerçek Gözüyle Prodüksiyon', 'Genç Belgeselciler Platformu']","['2018', '2020']",İstanbul,"['doğa yürüyüşleri yapmak', 'analog fotoğrafçılıkla ilgilenmek', 'dünya mutfaklarından yeni lezzetler denemek', 'bağımsız sinema salonlarında farklı filmler keşfetmek', 'Galatasaray maçlarına gitmek']",Caner Demir,"['Ada', 'Deniz']","['Dijital Çağda Belgesel Sinemanın Toplumsal Etkisi: Türkiye Örneği', 'Göçmen Kadınların Medya Temsili Üzerine Nitel Bir Çalışma']","['2015', '2014']",melek_aksoy.md,1994,2002,2002,2006,2007,2011,2012,2014,None,,['2011,"2012', '2014-2015', '2015-2018', '2018-devam ediyor']"
Melek Eren,Bursa,18.07.1989,35,Necatibey İlkokulu,1995-2000,Bursa Ahmet Hamdi Tanpınar Anadolu Lisesi,2003-2007,Boğaziçi Üniversitesi,2008-2012,Sanat Yönetimi ve İletişim Bölümü,Koç Üniversitesi,2013-2015,,None,"['Pera Müzesi', 'İstanbul Modern', 'Freelance Sanat Danışmanı', 'Sanat Köprüsü Derneği']","['2012-2013', '2015-2019', '2019-2021', '2021-devam ediyor']",['Sanat Köprüsü Derneği'],['2021'],İstanbul,"['analog fotoğrafçılık', 'doğa yürüyüşleri', 'trekking', 'piyano çalmak', 'kültürel miras gezileri']",Emre Doğan,"['Ada', 'Can']","[""Kentsel Dönüşümün İstanbul'un Tarihi Dokusu Üzerindeki Etkileri ve Kültürel Mirasın Korunması"", ""Dijital Sanat Platformlarının Türkiye'deki Genç Sanatçılar Üzerindeki Etkileri""]","['2015', '2020']",melek_eren.md,1995,2000,2003,2007,2008,2012,2013,2015,None,,['2012,"2013', '2015-2019', '2019-2021', '2021-devam ediyor']"
Melek Ermiş,Kayseri,15.08.1985,40,Kayseri Hürriyet İlkokulu,1991-1998,Kayseri Fen Lisesi,1998-2002,Orta Doğu Teknik Üniversitesi,2004-2008,Endüstri Mühendisliği,Bilkent Üniversitesi,2008-2010,,None,"['Yapı Kredi Bankası', 'ING Bank Türkiye', 'Microsoft Türkiye']","['2010-2014', '2014-2018', '2018-devam ediyor']",[],[],İstanbul,"['yoga yapmak', 'klasik Türk sanat müziği dinlemek', 'Uzak Doğu mutfağından yeni tarifler denemek', 'doğa yürüyüşleri yapmak', 'dijital illüstrasyonlar çizmek']",Emre Demirci,"['Defne Demirci', 'Can Demirci']",['Predictive Models for Credit Risk Assessment Using Ensemble Learning'],['2016'],melek_ermis.md,1991,1998,1998,2002,2004,2008,2008,2010,None,,['2010,"2014', '2014-2018', '2018-devam ediyor']"
Melek Yılmaz,Adana,20.03.1989,36,İsmet İnönü İlkokulu,1995-2002,Ankara Fen Lisesi,2002-2006,Orta Doğu Teknik Üniversitesi (ODTÜ),2007-2011,İstatistik,Boğaziçi Üniversitesi,2013-2015,,None,"['Accenture Türkiye', 'Koç Holding', 'Trendyol', 'PixelPath Dijital Ajansı']","['2011-2013', '2013-2017', '2017-2021', '2021-devam ediyor']",['PixelPath Dijital Ajansı'],['2021'],İstanbul,"['Sokak fotoğrafçılığı', 'botanik bahçeleri gezmek', 'farklı bitki türlerini keşfetmek', 'senaryo yazımı']",Can Ateş,"['Lara', 'Demir']","[""Yapay Zeka Destekli Pazarlama Stratejilerinin KOBİ'ler Üzerindeki Etkileri""]",['2015'],melek_yilmaz.md,1995,2002,2002,2006,2007,2011,2013,2015,None,,['2011,"2013', '2013-2017', '2017-2021', '2021-devam ediyor']"
Melis Demir,Adana,15.08.1988,37,Mehmet Akif Ersoy İlköğretim Okulu,1994-2000,Ankara Fen Lisesi,2002-2006,Boğaziçi Üniversitesi,2008-2012,Sanat Tarihi,İstanbul Teknik Üniversitesi (İTÜ),2012-2014,,None,"['İstanbul Modern Sanat Müzesi', 'Sanat Unlimited Dergisi', 'Garanti BBVA', 'Bağımsız Küratör ve Sanat Danışmanı', 'SALT Araştırma']","['2014-2016', '2016-2017', '2017-2020', '2020-2022', '2022-devam ediyor']",['Sanatla İç İçe'],['2021'],İstanbul,"['Klasik müzik dinlemek', 'Seramik atölyelerine katılmak', 'Doğa yürüyüşleri yapmak', 'Eski kitapları koleksiyonlamak', '20. yüzyıl başı edebiyatına ilgi duymak']",Can Demir,"['Defne', 'Emre']","['Dijital Sanatın Kürasyon Pratiklerine Etkisi', 'Müze Deneyiminde Yeni Yönelimler: Katılımcı Sanat Projeleri Üzerine Bir İnceleme']","['2019', '2021']",melis_demir.md,1994,2000,2002,2006,2008,2012,2012,2014,None,,['2014,"2016', '2016-2017', '2017-2020', '2020-2022', '2022-devam ediyor']"
Meltem Altun,İzmir,15.08.1986,39,İzmir Mithatpaşa İlköğretim Okulu,1993-2000,İzmir Atatürk Lisesi,2000-2004,Boğaziçi Üniversitesi,2004-2008,İşletme,Koç Üniversitesi,2010-2012,,None,"['P&G Türkiye', 'Migros Türk', 'Garanti BBVA', 'Emlakjet']","['2008-2011', '2011-2016', '2017-2020', '2020-devam ediyor']",[],[],İstanbul,"['yoga', 'şehir keşifleri', 'amatör fotoğrafçılık', 'bağımsız filmler izleme', 'seyahat etmek']",Can Demir,['Defne'],['Dijital Çağda Tüketici Davranışlarının Marka Sadakati Üzerindeki Etkileri'],['2012'],meltem_altun.md,1993,2000,2000,2004,2004,2008,2010,2012,None,,['2008,"2011', '2011-2016', '2017-2020', '2020-devam ediyor']"
Meltem Eren,İzmir,15.06.1989,36,Karşıyaka Cumhuriyet İlkokulu,1995-2000,İzmir Bornova Anadolu Lisesi,2000-2007,Boğaziçi Üniversitesi,2007-2011,Tarih Bölümü,İstanbul Üniversitesi,2012-2014,,None,"['Pera Müzesi', 'İstanbul Modern Sanat Müzesi', 'T.C. Kültür ve Turizm Bakanlığı Müzeler Genel Müdürlüğü']","['2014-2016', '2016-2019', '2019-devam ediyor']","[""Anadolu'nun Sesleri""]",[],İstanbul,"['kaligrafi', 'antika pazarlarını gezmek', 'eski şehirleri keşfetmek', 'tarihi roman okumak', 'arkeolojik alanları ziyaret etmek']",Demir Yılmaz,"['Defne', 'Can']","['Dijital Çağda Müze Deneyimi: Türkiye Örneği', ""Anadolu'nun Kayıp Mirasları ve Koruma Çalışmaları: Gelecek Nesillere Aktarım Stratejileri""]","['2018', '2022']",meltem_eren.md,1995,2000,2000,2007,2007,2011,2012,2014,None,,['2014,"2016', '2016-2019', '2019-devam ediyor']"
Meltem Karaca,Antalya,15.07.1988,37,Atatürk İlkokulu,1994-2000,Antalya Koleji,2000-2006,Ege Üniversitesi,2006-2010,Halkla İlişkiler ve Tanıtım,Galatasaray Üniversitesi,2010-2012,,None,"['Publicis Yorum Reklam Ajansı', 'Anadolu Grubu', 'Hepsiburada', 'Ecovolt Teknoloji A.Ş.']","['2012-2013', '2013-2017', '2017-2021', '2021-devam ediyor']",[],[],İstanbul,"['yoga', 'seramik sanatı', 'belgesel izlemek']",Onur Demir,['Elif'],"['Dijital Platformlarda Sürdürülebilirlik İletişiminin Tüketici Algısı Üzerindeki Etkisi', 'Kurumsal Sürdürülebilirlik Raporlamasında Yeni Trendler ve İletişim Stratejileri']","['2012', '2016']",meltem_karaca.md,1994,2000,2000,2006,2006,2010,2010,2012,None,,['2012,"2013', '2013-2017', '2017-2021', '2021-devam ediyor']"
Mert Çakır,İstanbul,07.03.1989,36,Bahçelievler Deneme İlkokulu,1995-2000,Pertevniyal Lisesi,2000-2007,Boğaziçi Üniversitesi,2007-2011,İşletme Bölümü,London School of Economics and Political Science (LSE),2012-2013,,None,"['Unilever Türkiye', 'Turkcell', 'Hype Marketing Ajansı']","['2011-2012', '2013-2016', '2016-devam ediyor']",['Hype Marketing'],['2016'],İstanbul,"['amatör fotoğrafçılık', 'uzak doğu mutfağını keşfetmek', 'oyun geliştirme']",Aslı,"['Ada', 'Can']",[],[],mert_cakir.md,1995,2000,2000,2007,2007,2011,2012,2013,None,,['2011,"2012', '2013-2016', '2016-devam ediyor']"
