ad,dogum_yeri,dogum_tarihi,yas,ilkokul,ilkokul_yillari,lise,lise_yillari,universite,universite_yillari,bolum,yuksek_lisans,yuksek_lisans_yillari,doktora,doktora_yillari,calistigi_kurumlar,calisma_yillari,kurdugu_girisim_ve_dernekler,girisim_kurulus_yillari,yasadigi_sehir,hobiler,es,cocuklar,akademik_yayinlar,yayin_yillari,dosya_adi,ilkokul_yillari_baslangic,ilkokul_yillari_bitis,lise_yillari_baslangic,lise_yillari_bitis,universite_yillari_baslangic,universite_yillari_bitis,yuksek_lisans_yillari_baslangic,yuksek_lisans_yillari_bitis,doktora_yillari_baslangic,doktora_yillari_bitis,calisma_yillari_baslangic,calisma_yillari_bitis
Ahmet Doğan,Kayseri,15.03.1988,37,Hacı Bektaş-ı Veli İlkokulu,1994-2002,Ankara Fen Lisesi,2002-2006,Orta Doğu Teknik Üniversitesi (ODTÜ),2006-2010,Bilgisayar Mühendisliği,Koç Üniversitesi,2010-2012,,None,"['ASELSAN', 'SAP Türkiye', 'Artemis Yazılım']","['2010-2014', '2014-2017', '2017-devam ediyor']",['Artemis Yazılım'],['2017'],İstanbul,"['Tarihi roman okumak', 'amatör drone fotoğrafçılığı', 'bağlama çalmak', 'açık kaynak yazılım projelerine katkıda bulunmak']",Elif Doğan,"['Deniz Doğan', 'Ada Doğan']",[],[],ahmet_dogan.md,1994,2002,2002,2006,2006,2010,2010,2012,None,,['2010,"2014', '2014-2017', '2017-devam ediyor']"
Akın Doğan,Bursa,15.06.1989,36,Bursa Osmangazi İlkokulu,1996-2000,Ankara Fen Lisesi,2002-2006,Orta Doğu Teknik Üniversitesi,2007-2011,Elektrik ve Elektronik Mühendisliği,Hacettepe Üniversitesi,2011-2013,,None,"['ASELSAN', 'Türk Havacılık ve Uzay Sanayii A.Ş.', 'İleri Otomasyon Teknolojileri A.Ş.']","['2010-2014', '2014-2019', '2019-devam ediyor']",['Geleceğin Mühendisleri Derneği'],[],Ankara,"['drone fotoğrafçılığı', 'dağ yürüyüşleri', 'robotik kodlama']",Elif Kaya,"['Deniz', 'Can']","['Adaptive Control of Robotic Manipulators Using Reinforcement Learning', 'Real-time Object Recognition for Autonomous Navigation Systems in Unstructured Environments']","['2012', '2014']",akin_dogan.md,1996,2000,2002,2006,2007,2011,2011,2013,None,,['2010,"2014', '2014-2019', '2019-devam ediyor']"
Ali Türkmen,Samsun,10.03.1988,37,Samsun Atakum İlk Adım İlköğretim Okulu,1995-2002,Ankara Fen Lisesi,2002-2006,Orta Doğu Teknik Üniversitesi (ODTÜ),2006-2010,Şehir ve Bölge Planlama,Hacettepe Üniversitesi,2011-2013,,None,"['Ankara Büyükşehir Belediyesi', 'ASELSAN', 'TEMA Vakfı', 'Birleşmiş Milletler Kalkınma Programı (UNDP) Türkiye Ofisi', 'Sürdürülebilir Kentler Araştırma ve Danışmanlık']","['2010-2011', '2011-2014', '2014-2018', '2018-2022', '2022-devam ediyor']",['Sürdürülebilir Kentler Araştırma ve Danışmanlık'],['2022'],Ankara,"['Doğa yürüyüşleri', 'Kuş gözlemciliği', 'Analog fotoğrafçılık', 'Tarih kitapları okumak', 'Farklı kültürleri araştırmak']",Ayşe Türkmen,"['Efe Türkmen', 'Zeynep Türkmen']","[""Ankara'da Yeşil Altyapı Planlamasının Kentsel Dirençliliğe Etkileri"", ""Türkiye'de Kentsel Dönüşüm Projelerinde Katılımcı Yaklaşımların Analizi""]","['2017', '2020']",ali_turkmen.md,1995,2002,2002,2006,2006,2010,2011,2013,None,,['2010,"2011', '2011-2014', '2014-2018', '2018-2022', '2022-devam ediyor']"
Alparslan Aydın,Ankara,07.03.1985,40,Çankaya İlkokulu,1991-1996,Anıttepe Lisesi,1999-2003,Gazi Üniversitesi,2003-2007,Mimarlık,Mimar Sinan Güzel Sanatlar Üniversitesi,2008-2010,,None,"['Görkem Mimarlık', 'Tektaş Mimarlık', 'Mesa Mesken Sanayii A.Ş.', 'Kadim Sanat Mimarlık']","['2007-2008', '2010-2014', '2014-2019', '2019-devam ediyor']",['Kadim Sanat Mimarlık'],['2019'],İstanbul,"['Urban sketching', 'Suluboya ile tarihi mekan çizimi', 'Antik kent ve ören yeri ziyaretleri', 'Ahşap model yapımı', 'Klasik Türk müziği dinlemek', 'Ud çalmak', 'Eski kitap, harita ve mimari çizim koleksiyonları toplamak']",Elif Aydın,"['Can Aydın', 'Zeynep Aydın']","['Cumbalı Evlerden Butik Otellere: Beyoğlu Sivil Mimarisinde Fonksiyonel Dönüşüm', ""Anadolu'daki Roma Tiyatrolarının Kent Dokusuna Entegrasyonu Üzerine Bir Araştırma"", ""Tarihi Yarımada'da Sürdürülebilir Restorasyon Yaklaşımları""]","['2014', '2017', '2021']",alparslan_aydin.md,1991,1996,1999,2003,2003,2007,2008,2010,None,,['2007,"2008', '2010-2014', '2014-2019', '2019-devam ediyor']"
Alperen Aydın,İzmir,15.08.1985,40,Mustafa Kemal İlkokulu,1991-1996,İzmir Bornova Anadolu Lisesi,1996-2003,Ege Üniversitesi,2003-2007,Halkla İlişkiler ve Tanıtım,Bahçeşehir Üniversitesi,2009-2011,,None,"['Marka İletişim Ajansı', 'Trendyol', 'Turkcell', 'Hepsiburada', 'Dijital Köprü']","['2007-2009', '2009-2013', '2013-2017', '2017-2021', '2021-devam ediyor']",['Dijital Köprü'],['2021'],İstanbul,"['amatör fotoğrafçılık', 'doğa fotoğrafçılığı', 'sokak fotoğrafçılığı', 'uzun yürüyüşler', 'kampçılık', 'eski Türk filmlerini izlemek', 'mutfakta yeni yemek tarifleri denemek']",Elif Aydın,"['Deniz', 'Can']","['Sosyal Medyanın Tüketici Satın Alma Kararları Üzerindeki Etkisi: E-Ticaret Sektöründe Bir Araştırma', 'Dijital Eşitsizliği Azaltmada Sosyal Girişimlerin Rolü: Dijital Köprü Örneği']","['2011', '2022']",alperen_aydin.md,1991,1996,1996,2003,2003,2007,2009,2011,None,,['2007,"2009', '2009-2013', '2013-2017', '2017-2021', '2021-devam ediyor']"
Alperen Baran,Kayseri,15.06.1989,36,Kayseri Osman Düşüngel İlköğretim Okulu,1996-2000,Kayseri Nuh Mehmet Baldöktü Anadolu Lisesi,2000-2004,Boğaziçi Üniversitesi,2008-2012,Ekonomi,Koç Üniversitesi,2013-2015,,None,"['Yapı Kredi Bankası', 'Garanti BBVA']","['2012-2017', '2017-2020']",['Portföyüm.ai'],['2020'],İstanbul,"['koşu yapmak', 'doğa fotoğrafçılığı', 'finansal teknoloji trendlerini takip etmek', 'yerel maratonlara katılmak']",Elif Şahin,"['Zeynep', 'Emre']","['Bireysel Yatırımcı Tercihlerinde Dijital Aracılık Platformlarının Rolü', 'Algoritmik Ticaretin Türkiye Borsaları Üzerindeki Etkisi: Bir Vaka Analizi']","['2016', '2019']",alperen_baran.md,1996,2000,2000,2004,2008,2012,2013,2015,None,,['2012,"2017', '2017-2020']"
Alperen Uzun,Kayseri,15.06.1986,39,Erciyes İlköğretim Okulu,1993-2000,Kayseri Fen Lisesi,2000-2004,İstanbul Teknik Üniversitesi (İTÜ),2005-2009,Şehir ve Bölge Planlama,Boğaziçi Üniversitesi,2009-2011,,None,"['Kültür ve Turizm Bakanlığı', 'Pera Müzesi', 'Koç Üniversitesi Vehbi Koç Ankara Araştırmaları Uygulama ve Araştırma Merkezi (VEKAM)']","['2011-2014', '2014-2018', '2018-devam ediyor']",['Miras Dijital'],['2019'],Ankara,"['eski haritalar toplamak', 'şehirlerin az bilinen köşelerinde yürüyüşler yapmak', 'yerel pazarları gezerek kaybolan zanaatları keşfetmek', 'belgesel izlemek', 'Osmanlıca öğrenmek']",Elif Uzun,"['Defne', 'Demir']","[""Türkiye'deki Osmanlı Arşivlerinin Dijitalleştirilmesi Süreçleri ve Zorlukları"", 'Kültürel Mirasın Blockchain Teknolojisi ile Korunması Üzerine Bir Araştırma', 'Anadolu Kentlerinin Kentsel Belleği: Dijital Hikayecilik Yaklaşımı']","['2015', '2021', '2023']",alperen_uzun.md,1993,2000,2000,2004,2005,2009,2009,2011,None,,['2011,"2014', '2014-2018', '2018-devam ediyor']"
Alperen Yılmaz,Ankara,07.03.1989,36,Ankara Mimar Kemal İlköğretim Okulu,1995-2002,Ankara Fen Lisesi,2002-2006,Orta Doğu Teknik Üniversitesi (ODTÜ),2007-2011,Bilgisayar Mühendisliği,Bilkent Üniversitesi,2011-2013,,None,"['VeriFabrikası Teknoloji A.Ş.', 'Garanti BBVA', 'sahibinden.com']","['2013-2015', '2015-2019', '2019-devam ediyor']",['Kodlama Atölyesi'],['2021'],Ankara,"['doğa yürüyüşleri yapmak', 'amatör fotoğrafçılık', 'yapay zeka ile dijital sanat eserleri üretmek', 'bilim kurgu romanı okumak', 'yeni teknoloji makaleleri okumak']",Elif Yılmaz,"['Ada', 'Can']","['Deep Learning for Emotion Recognition in Textual Data', 'Ethical Implications of AI in Financial Services']","['2013', '2018']",alperen_yilmaz.md,1995,2002,2002,2006,2007,2011,2011,2013,None,,['2013,"2015', '2015-2019', '2019-devam ediyor']"
Ayhan Korkmaz,Ankara,18.04.1986,39,Ankara Mehmet Akif Ersoy İlkokulu,1992-1997,Ankara Atatürk Anadolu Lisesi,1997-2001,Orta Doğu Teknik Üniversitesi (ODTÜ),2004-2008,İnşaat Mühendisliği,Hacettepe Üniversitesi,2010-2012,,None,"['Çalık Enerji', 'Emlak Konut GYO']","['2008-2013', '2013-2018']","['Yeşil Şehirler İnisiyatifi', 'Genç Şehir Plancıları Derneği']","['2018', None]",Ankara,"['dağcılık', 'yürüyüş', 'analog fotoğrafçılık', 'tarih okumak', 'belgesel izlemek']",Elif Korkmaz,"['Defne', 'Can']","[""Ankara'da Kentsel Dönüşüm Projelerinin Sosyal Sürdürülebilirlik Üzerine Etkileri"", ""Türkiye'de Akıllı Şehir Uygulamaları ve Gelecek Potansiyelleri""]","['2013', '2016']",ayhan_korkmaz.md,1992,1997,1997,2001,2004,2008,2010,2012,None,,['2008,"2013', '2013-2018']"
Ayla Çakır,Ankara,15.06.1988,37,Çankaya Mehmet Akif Ersoy İlkokulu,1994-2000,Ankara Çankaya Ayrancı Anadolu Lisesi,2000-2004,Ankara Üniversitesi,2004-2008,Arkeoloji Bölümü,Hacettepe Üniversitesi,2008-2010,Ege Üniversitesi,2012-2017,"['Ankara Anadolu Medeniyetleri Müzesi', 'Kültür ve Turizm Bakanlığı, Kültürel Miras ve Müzeler Genel Müdürlüğü', 'İzmir Büyükşehir Belediyesi, Kültür ve Sanat Daire Başkanlığı', 'Miras Adına Danışmanlık ve Eğitim Hizmetleri']","['2010-2012', '2012-2017', '2017-2021', '2021-devam ediyor']",['Miras Adına Danışmanlık ve Eğitim Hizmetleri'],['2021'],İzmir,"['amatör fotoğrafçılık', 'el sanatları atölyelerine katılmak', 'doğa yürüyüşleri', ""Türkiye'nin kültürel rotalarında seyahat etmek"", 'klasik müzik dinlemek', 'tarihi romanlar okumak']",Caner Demir,"['Defne', 'Alp']","[""Türkiye'de Kent Müzeciliği ve Sürdürülebilirlik"", 'Dijital Çağda Arkeolojik Mirasın Belgelenmesi ve Sunumu: Anadolu Örneği', 'Kültürel Mirasın Toplumsal Katılımla Korunması: İzmir Kent Belleği Projesi Üzerine Bir İnceleme', 'Sanal Gerçeklik ile Antik Kent Deneyimi: Efes Örneği']","['2010', '2017', '2019', '2022']",ayla_cakir.md,1994,2000,2000,2004,2004,2008,2008,2010,2012,2017,['2010,"2012', '2012-2017', '2017-2021', '2021-devam ediyor']"
Ayla Özdemir,İzmir,15.07.1985,40,İzmir Bornova Koleji,1991-1999,İzmir Fen Lisesi,2000-2004,Dokuz Eylül Üniversitesi,2004-2008,Mimarlık,İstanbul Teknik Üniversitesi,2008-2010,,None,"[""İzmir'deki küçük bir mimarlık ofisi"", 'Era Mimarlık ve Gayrimenkul', 'Arçelik A.Ş.', 'Çevre ve Şehircilik Bakanlığı Kentleşme Genel Müdürlüğü', 'Sürdürülebilir Kentler Derneği']","['2008-2009', '2010-2012', '2012-2016', '2016-2021', '2021-devam ediyor']",['Sürdürülebilir Kentler Derneği'],['2021'],İstanbul,"['doğa yürüyüşleri', 'kuş gözlemciliği', 'şehir bahçeciliği', 'klasik müzik dinlemek', 'yerel pazarlardan taze ürünler alıp yeni tarifler denemek']",Emre Aksoy,"['Zeynep', 'Can']","['Kentsel Dönüşümde Yeşil Alanların Sürdürülebilirliği: İzmir Örneği', 'İklim Değişikliğine Dirençli Kent Tasarımları Üzerine Bir Araştırma', 'Dairesel Ekonomi Yaklaşımıyla Kent Mobilyaları Tasarımı']","['2010', '2017', '2022']",ayla_ozdemir.md,1991,1999,2000,2004,2004,2008,2008,2010,None,,['2008,"2009', '2010-2012', '2012-2016', '2016-2021', '2021-devam ediyor']"
Ayla Toprak,Antalya,15.03.1987,38,Antalya Koleji İlkokulu,1993-2000,Antalya Anadolu Lisesi,2000-2005,İstanbul Teknik Üniversitesi,2005-2009,Şehir ve Bölge Planlama,Gazi Üniversitesi,2010-2012,,None,"['İstanbul Büyükşehir Belediyesi Şehir Planlama Müdürlüğü', 'Çevre, Şehircilik ve İklim Değişikliği Bakanlığı', 'Kentsel Gelişim Danışmanlık A.Ş.', 'Yaşanabilir Şehirler Vakfı']","['2009', '2012-2018', '2018-2023', '2023-devam ediyor']",['Kent Bahçeleri Derneği'],['2015'],Ankara,"['yoga', 'farklı şehirlerin sokaklarında uzun yürüyüşler yapmak', 'amatör fotoğrafçılık', 'mimari ve şehir planlama belgesellerini izlemek']",Can Yıldız,"['Elif', 'Deniz']",['Akıllı Şehir Çözümlerinin Kentsel Dönüşüm Projelerine Etkisi: Ankara Örneği'],['2017'],ayla_toprak.md,1993,2000,2000,2005,2005,2009,2010,2012,None,,"['2009', '2012","2018', '2018-2023', '2023-devam ediyor']"
Ayşegül Keskin,Adana,15.08.1989,36,Adana Merkez İlkokulu,1995-2000,Adana Fen Lisesi,2000-2004,Orta Doğu Teknik Üniversitesi (ODTÜ),2004-2008,Kimya Mühendisliği,Gazi Üniversitesi,2008-2010,,None,"['Pınar Süt', 'Danone Türkiye', 'Ülker']","['2010-2014', '2014-2018', '2018-2021']","['BioSens Gıda Teknolojileri', 'Gıda Atıklarını Azaltma Derneği (GİDAD)']","['2021', '2022']",İstanbul,"['yemek tarifleri denemek', 'doğa yürüyüşleri yapmak', 'organik sebze ve meyve yetiştirmek', 'Klasik Türk Müziği dinlemek', 'amatör fotoğrafçılık']",Can Yılmaz,"['Elif', 'Bora']","['Peynir Altı Suyunun Biyodizel Üretiminde Kullanımı Üzerine Bir Araştırma', 'Yenilikçi Protein Kaynaklarının Sürdürülebilir Gıda Üretimine Entegrasyonu']","['2011', '2019']",aysegul_keskin.md,1995,2000,2000,2004,2004,2008,2008,2010,None,,['2010,"2014', '2014-2018', '2018-2021']"
Aysel Öztürk,İzmir,15.07.1989,36,Şehit Fethi Bey İlköğretim Okulu,1995-2003,İzmir Türk Koleji,2003-2007,Boğaziçi Üniversitesi,2008-2012,İşletme,Sabancı Üniversitesi,2014-2016,,None,"['Unilever Türkiye', 'Google Türkiye', 'Trendyol', 'DigiInsights Danışmanlık']","['2012-2014', '2016-2019', '2019-2023', '2023-devam ediyor']",['DigiInsights Danışmanlık'],['2023'],İstanbul,"['yoga yapmak', 'seramik sanatıyla uğraşmak', 'seyahat blogu yazmak']",Can Yılmaz,"['Elif', 'Deniz']",['Sosyal Medya Etkileyicilerinin Marka Algısı Üzerindeki Etkileri ve Tüketici Karar Süreçleri'],['2017'],aysel_ozturk.md,1995,2003,2003,2007,2008,2012,2014,2016,None,,['2012,"2014', '2016-2019', '2019-2023', '2023-devam ediyor']"
Ayşe Çakır,İzmir,15.06.1989,36,Atatürk İlkokulu,1995-2003,Bornova Anadolu Lisesi,2003-2007,Dokuz Eylül Üniversitesi,2007-2011,Güzel Sanatlar Fakültesi Fotoğraf Bölümü,Marmara Üniversitesi,2012-2014,,None,"['Tribal Worldwide İstanbul', 'TBWA\\Istanbul', 'Ayşe Çakır Fotoğraf Stüdyosu']","['2011-2013', '2013-2017', '2017-devam ediyor']",['Ayşe Çakır Fotoğraf Stüdyosu'],['2017'],İstanbul,"['analog fotoğraf makineleri koleksiyonu yapmak', 'dünya mutfaklarından vegan tarifler denemek', 'İskandinav sineması belgeselleri izlemek', 'pilates yapmak', 'yoga yapmak']",Can Yılmaz,['Ela Yılmaz'],"[""Anadolu'nun Yüzleri"", 'Şehrin Işıkları, Doğanın Gölgesi']","['2019', '2021']",ayse_cakir.md,1995,2003,2003,2007,2007,2011,2012,2014,None,,['2011,"2013', '2013-2017', '2017-devam ediyor']"
Aysun Uçar,Eskişehir,05.07.1987,38,Eskişehir Zübeyde Hanım İlkokulu,1993-2000,Eskişehir Fatih Lisesi,2000-2004,Marmara Üniversitesi,2004-2008,Halkla İlişkiler ve Tanıtım,İstanbul Bilgi Üniversitesi,2008-2010,,None,"['PRNet İletişim Danışmanlığı', 'Koç Holding', 'Türk Telekom', 'Doğan Holding', 'Pera Müzesi']","['2010-2013', '2013-2015', '2015-2018', '2018-2022', '2022-devam ediyor']",['Her Mahalleye Bir Sanat Atölyesi'],[],İstanbul,"['çağdaş sanat sergilerini gezmek', 'doğa fotoğrafçılığı yapmak', 'uzun mesafe koşuları', 'felsefe ve psikoloji üzerine kitaplar okumak']",Emre Sayın,"['Deniz', 'Can']","[""Türkiye'de Çağdaş Sanat Müzelerinin Kurumsal İletişim Stratejileri ve Kamuoyu Algısı Üzerine Bir Araştırma"", 'Kentsel Dönüşüm Projelerinde Halkla İlişkiler Stratejilerinin Rolü: İstanbul Örneği']","['2011', '2016']",aysun_ucar.md,1993,2000,2000,2004,2004,2008,2008,2010,None,,['2010,"2013', '2013-2015', '2015-2018', '2018-2022', '2022-devam ediyor']"
Bahar Erdoğan,Kayseri,15.06.1988,37,Kayseri Kadir Has İlkokulu,1994-2001,Kayseri Sümer Anadolu Lisesi,2001-2005,Boğaziçi Üniversitesi,2003-2007,Siyaset Bilimi ve Uluslararası İlişkiler,Galatasaray Üniversitesi,2009-2011,,None,"['Ogilvy İstanbul', 'Koç Holding', 'Garanti BBVA', 'Anadolu Mirası Sürdürülebilir Turizm Derneği']","['2011-2013', '2013-2017', '2017-2020', '2021-devam ediyor']",['Anadolu Mirası Sürdürülebilir Turizm Derneği'],['2021'],İstanbul,"['doğa yürüyüşleri', 'klasik müzik dinlemek', 'fotoğrafçılık', 'eski Türk filmleri izlemek', 'blog yazmak']",Can Yılmaz,"['Ela Yılmaz', 'Arda Yılmaz']","[""Türkiye'de Kurumsal Sosyal Sorumluluk Projelerinin Kamuya Etkileri ve Algılanması""]",['2011'],bahar_erdogan.md,1994,2001,2001,2005,2003,2007,2009,2011,None,,['2011,"2013', '2013-2017', '2017-2020', '2021-devam ediyor']"
Baran Keskin,Diyarbakır,15.08.1982,43,Diyarbakır Şehitlik İlkokulu,1988-1996,Diyarbakır Süleyman Demirel Anadolu Lisesi,1996-2000,Ege Üniversitesi,2000-2004,Gazetecilik Bölümü,Marmara Üniversitesi,2005-2007,,None,"['Güneydoğu Ses Gazetesi', 'Milliyet Gazetesi', 'Hürriyet Daily News (Dijital)', 'Medya A.Ş.']","['2004-2005', '2007-2012', '2012-2018', '2018-devam ediyor']",['Haber Atlası'],['2019'],İstanbul,"['amatör fotoğrafçılık', 'belgesel izlemek', 'tenis oynamak', 'seyahat etmek', 'eski Türk filmleri koleksiyonculuğu']",Zeynep Keskin,"['Ada', 'Deniz']","['Yeni Medya ve Toplumsal Algı Değişimi: Türkiye Örneği', 'Dijital Dezenformasyon Çağında Haber Okuryazarlığı: Gençlerin Rolü', 'Algının Peşinde: Dijital Çağda Haber ve Gerçeklik']","['2007', '2016', '2015']",baran_keskin.md,1988,1996,1996,2000,2000,2004,2005,2007,None,,['2004,"2005', '2007-2012', '2012-2018', '2018-devam ediyor']"
Batuhan Özdemir,Adana,12.08.1989,36,Adana Mehmet Akif Ersoy İlkokulu,1996-2000,Ankara Fen Lisesi,2003-2007,Orta Doğu Teknik Üniversitesi (ODTÜ),2007-2011,Bilgisayar Mühendisliği Bölümü,Boğaziçi Üniversitesi,2011-2013,,None,"['Teknofix A.Ş.', 'Arçelik A.Ş.', 'Microsoft Türkiye', 'Getir']","['2011-2013', '2013-2016', '2016-2020', '2020-devam ediyor']",[],[],İstanbul,"['bağlama çalmak', 'doğa yürüyüşleri', 'drone fotoğrafçılığı', 'yeni teknolojileri takip etmek']",Ayşe Özdemir,"['Elif Özdemir', 'Can Özdemir']","['Interpretable Machine Learning Models for Supply Chain Optimization', 'Ethical Considerations in Predictive Analytics for Consumer Behavior']","['2018', '2021']",batuhan_ozdemir.md,1996,2000,2003,2007,2007,2011,2011,2013,None,,['2011,"2013', '2013-2016', '2016-2020', '2020-devam ediyor']"
Batuhan Uçar,Antalya,15.08.1983,42,İsmet İnönü İlkokulu,1990-1997,Antalya Lisesi,1997-2001,Akdeniz Üniversitesi,2001-2005,Halkla İlişkiler ve Tanıtım,İstanbul Üniversitesi,2007-2009,,None,"['McCann Erickson İstanbul', 'Türk Hava Yolları (THY)', 'Vodafone Türkiye', 'Türk Telekom', 'Siemens Türkiye']","['2005-2007', '2007-2010', '2010-2014', '2014-2018', '2018-devam ediyor']",[],[],İstanbul,"['fotoğrafçılık', 'sokak fotoğrafçılığı', 'belgesel fotoğrafçılığı', 'bisiklet turları yapmak', 'farklı kültürlerin mutfaklarını deneyimlemek', 'kısa film senaryoları yazmak']",Elif Öztürk,"['Zeynep', 'Emre']","['Dijital Çağda Kriz İletişimi: Sosyal Medyanın Rolü', 'Marka Elçiliği ve Çalışan Bağlılığı İlişkisi Üzerine Bir Araştırma']","['2010', '2015']",batuhan_ucar.md,1990,1997,1997,2001,2001,2005,2007,2009,None,,['2005,"2007', '2007-2010', '2010-2014', '2014-2018', '2018-devam ediyor']"
Baturalp Polat,Adana,15.03.1982,43,Adana İsmet İnönü İlkokulu,1988-1996,Adana Anadolu Lisesi,1996-2000,Orta Doğu Teknik Üniversitesi (ODTÜ),2000-2004,İnşaat Mühendisliği,Hacettepe Üniversitesi,2004-2006,,None,"['TAV İnşaat A.Ş.', 'Koç Holding', 'Yeşil Şehirler Danışmanlık A.Ş.']","['2006-2013', '2013-2017', '2017-devam ediyor']",['Yeşil Şehirler Danışmanlık A.Ş.'],['2017'],İstanbul,"['şehir manzarası fotoğrafları çekmek', 'doğa yürüyüşleri yapmak', 'klasik müzik dinlemek', 'mimari tarih üzerine kitaplar okumak', 'kent sosyolojisi üzerine kitaplar okumak']",Ayşe Polat,"['Deniz', 'Cem']","['Kentsel Dönüşümde Yeşil Alan Entegrasyonu: Ankara Örneği', 'Akıllı Şehirler ve Sürdürülebilir Ulaşım Modelleri: İstanbul Analizi']","['2015', '2019']",baturalp_polat.md,1988,1996,1996,2000,2000,2004,2004,2006,None,,['2006,"2013', '2013-2017', '2017-devam ediyor']"
Betül Doğan,Adana,15.03.1983,42,Adana İsmet İnönü İlkokulu,1989-1997,Adana Sunar Nuri Çomu Anadolu Lisesi,1997-2001,Hacettepe Üniversitesi,2001-2005,Halkla İlişkiler ve Tanıtım,Boğaziçi Üniversitesi,2007-2009,,None,"['Unilever Türkiye', 'Vestel', 'Coca-Cola İçecek', 'Garanti BBVA', 'Turkcell']","['2005-2007', '2009-2012', '2012-2017', '2017-2020', '2020-devam ediyor']",[],[],İstanbul,"['pilates yapmak', 'seyahat blogu yazmak', 'el yapımı sabun üretimiyle uğraşmak']",Can Doğan,"['Ela', 'Deniz']","['Dijital Dönüşümün Tüketici Davranışlarına Etkisi: FMCG Sektörü Örneği', 'Sürdürülebilir Marka Yönetimi ve Z Kuşağı']","['2009', '2021']",betul_dogan.md,1989,1997,1997,2001,2001,2005,2007,2009,None,,['2005,"2007', '2009-2012', '2012-2017', '2017-2020', '2020-devam ediyor']"
Betül Erdoğan,Bursa,15.08.1986,39,Çelebi Mehmet İlkokulu,1993-2000,Bursa Anadolu Lisesi,2000-2004,Orta Doğu Teknik Üniversitesi,2004-2008,Mimarlık,İstanbul Teknik Üniversitesi,2009-2011,,None,"['T.C. Çevre ve Şehircilik Bakanlığı', 'İstanbul Büyükşehir Belediyesi', 'Kültürel Mirasın Korunması Vakfı', 'Miras Mimari Danışmanlık']","['2008-2012', '2012-2017', '2017-2022', '2022-devam ediyor']",['Miras Mimari Danışmanlık'],['2022'],İstanbul,"['Fotoğrafçılık', 'Türk Sanat Müziği', 'Kaligrafi']",Emre Güngör,"['Selin', 'Can']","['Kent Kimliği ve Kentsel Bellek: İstanbul Örneği', ""Bursa'nın Tarihi Mahallelerinde Sürdürülebilir Dönüşüm ve Toplumsal Katılım""]","['2011', '2015']",betul_erdogan.md,1993,2000,2000,2004,2004,2008,2009,2011,None,,['2008,"2012', '2012-2017', '2017-2022', '2022-devam ediyor']"
Bülent Yıldız,Kayseri,14.07.1985,40,Sümer İlkokulu,1991-1996,Ankara Fen Lisesi,2002-2006,Orta Doğu Teknik Üniversitesi (ODTÜ),2007-2011,Bilgisayar Mühendisliği,Hacettepe Üniversitesi,2011-2013,,None,"['Turkcell', 'Arçelik', 'ING Bank', 'VeriVizyon AI']","['2013-2014', '2014-2017', '2018-2021', '2021-devam ediyor']",['VeriVizyon AI'],['2021'],Ankara,"['doğa yürüyüşleri', 'fotoğraf çekmek', 'kuş fotoğrafçılığı', 'bağlama çalmak', 'müzik grubu provalarına katılmak']",Ayşe Demir,"['Deniz', 'Can']","['Büyük Veri Analitiğinde Gerçek Zamanlı Akış İşleme Yöntemlerinin Karşılaştırılması', 'Makine Öğrenimi Modellerinde Açıklanabilirlik ve Şeffaflık Yaklaşımları: Regülasyonlara Uyum ve Uygulama Zorlukları', 'Derin Öğrenme ile Doğal Dil İşlemede Duygu Analizi Yöntemleri ve Finansal Piyasalara Uygulamaları']","['2013', '2018', '2020']",bulent_yildiz.md,1991,1996,2002,2006,2007,2011,2011,2013,None,,['2013,"2014', '2014-2017', '2018-2021', '2021-devam ediyor']"
Burak Acar,İzmir,15.08.1986,39,Bornova Piri Reis İlkokulu,1992-2000,İzmir Fen Lisesi,2000-2004,Orta Doğu Teknik Üniversitesi,2004-2008,Makine Mühendisliği,Koç Üniversitesi,2008-2010,,None,"['ASELSAN', 'Arçelik', 'Türk Telekom', 'Garanti BBVA', 'PerformAI Analytics']","['2010-2014', '2014-2016', '2016-2018', '2018-2021', '2021-devam ediyor']",['PerformAI Analytics'],['2021'],İstanbul,"['maraton koşusu', 'doğa yürüyüşleri', 'amatör fotoğrafçılık']",Ayşe Yılmaz,"['Deniz', 'Ege']",['Spor Endüstrisinde Büyük Veri Kullanımı ve Finansal Modelleme: Türk Kulüpleri Üzerine Bir Vaka Analizi'],['2022'],burak_acar.md,1992,2000,2000,2004,2004,2008,2008,2010,None,,['2010,"2014', '2014-2016', '2016-2018', '2018-2021', '2021-devam ediyor']"
Burcu Özsoy,Ankara,15.07.1991,34,Çayyolu İlkokulu,1997-2005,Ankara Fen Lisesi,2005-2009,Hacettepe Üniversitesi,2009-2013,İstatistik Bölümü,Boğaziçi Üniversitesi,2015-2017,,None,"['Turkcell', 'Garanti BBVA', 'Papara']","['2013-2015', '2017-2020', '2020-devam ediyor']",[],[],İstanbul,"['gezginlik', 'doğa yürüyüşleri', 'kamp yapmak', 'fotoğrafçılık', 'dijital sanat', 'kitap okumak']",Caner Özsoy,['Ada Özsoy'],"[""Türkiye'deki Tüketici Harcamalarında Anormal Davranışların Tespitine Yönelik Makine Öğrenimi Yaklaşımları"", 'Fintech Sektöründe Kullanıcı Kaybını Önlemede Prediktif Analitik Modellerin Rolü']","['2017', '2019']",burcu_ozsoy.md,1997,2005,2005,2009,2009,2013,2015,2017,None,,['2013,"2015', '2017-2020', '2020-devam ediyor']"
Burhan Doğan,Balıkesir,15.07.1984,41,Balıkesir Cumhuriyet İlkokulu,1990-1995,Balıkesir Sırrı Yırcalı Anadolu Lisesi,1995-2002,Orta Doğu Teknik Üniversitesi (ODTÜ),2004-2008,Bilgisayar Mühendisliği,Orta Doğu Teknik Üniversitesi (ODTÜ),2008-2010,Hacettepe Üniversitesi,2012-2016,"['ASELSAN', 'IBM Türkiye', 'SportAnalytica']","['2010-2014', '2014-2017', '2018-devam ediyor']",['SportAnalytica'],['2018'],İstanbul,"['uzun mesafe koşmak', 'amatör drone fotoğrafçılığı', 'satranç']",Ayşe Doğan,"['Elif Doğan', 'Can Doğan']","['Machine Learning Applications in Athlete Performance Prediction from Wearable Sensor Data', 'Optimizing Training Regimens for Endurance Sports using AI-Driven Feedback Loops', 'Real-time Biometric Data Analysis for Injury Prevention in Team Sports']","['2015', '2018', '2021']",burhan_dogan.md,1990,1995,1995,2002,2004,2008,2008,2010,2012,2016,['2010,"2014', '2014-2017', '2018-devam ediyor']"
